p-value	q-value	term_goid	term_category	term_level	term_name	members_input_overlap	members_input_overlap_geneids	size	effective_size
0.00458273318695	0.645725446969	GO:0045765	b	5	regulation of angiogenesis	133; 183; 185; 285; 388; 577; 947; 1386; 1512; 1870; 1969; 2321; 2624; 2626; 2627; 2693; 3082; 3091; 3315; 3397; 4086; 4215; 4780; 4838; 5140; 5607; 7057; 7422; 7453; 7474; 8038; 23213; 9037; 9270; 9475; 9982; 10365; 10457; 10769; 80149; 284361; 22846; 25865; 56999; 27286; 60675; 26051; 63943; 64102	PPP1R16B; NODAL; PLK2; CD34; EPHA2; HIF1A; GATA6; ADAM12; MAP2K5; ZC3H12A; AGT; ITGB1BP1; GATA4; FLT1; TNMD; MAP3K3; ADAMTS9; GPNMB; SULF1; PDE3B; KLF2; FGFBP1; ANGPT2; EMC10; ADGRB3; CTSH; VASH1; SRPX2; HSPB1; WARS; SMAD1; VEGFA; HGF; RHOB; GHSR; ADM; GATA2; WNT5A; E2F2; SEMA5A; PROK2; FKBPL; ROCK2; ID1; NFE2L2; AGTR1; THBS1; PRKD2; ATF2	284	57
0.00459662960215	0.278423932779	GO:0048729	b	3	tissue morphogenesis	90; 133; 182; 183; 388; 538; 653; 977; 1072; 1175; 1282; 1427; 1512; 1855; 1969; 2132; 2294; 166336; 2535; 2626; 2648; 2821; 2909; 3082; 3091; 3237; 3491; 3845; 4086; 4088; 4092; 4208; 4487; 4609; 4838; 4920; 5087; 5100; 5311; 5361; 5469; 56998; 6469; 6495; 6496; 6591; 6659; 55727; 6692; 6722; 6899; 6926; 6939; 7043; 7414; 7422; 7471; 7474; 7476; 7477; 7481; 7798; 7976; 8195; 23213; 8322; 8323; 170690; 8456; 8543; 8854; 55966; 9948; 10371; 10959; 11019; 7482; 79191; 79192; 343930; 81839; 83605; 51176; 51804; 85407; 54910; 55036; 55366; 22943; 219736; 23242; 23245; 23462; 23654; 23767; 25865; 89780; 57167; 153572; 57493; 57662; 255743; 157506; 27031; 27302; 60412; 64783; 126695; 63943; 64399	AGT; SPINT1; SIX4; SIX1; SIX3; FOXF1; MKKS; IRX1; IRX3; IRX2; CTSH; SMAD7; EXT2; WDR1; SMAD1; FLRT3; SNAI2; GATA4; CCDC40; ROR2; KRAS; BMP5; FKBPL; TCF15; MSGN1; WNT7A; WNT1; WNT7B; LGR4; KAT2A; CD151; MED1; VANGL1; ATP7A; HEG1; PLXNB2; AP2S1; SEMA4C; AJAP1; CCM2; ASTN2; VEGFA; COL4A1; SHH; RHOB; CAMSAP3; HOXD11; MEF2C; WNT5A; HHIP; WNT3A; NODAL; CRYGS; EPHA2; SMAD3; NPHP3; TBX3; TBX1; ADAMTS16; FZD2; FZD3; FZD4; TMED2; FZD6; STOX1; RBM15; NKD1; SRF; BTBD7; SALL4; HIF1A; LEF1; ADM; MYC; HEY1; SEMA3A; PKD2; PLXNA1; LMO4; NPNT; COBL; PRKD2; TGFB3; ACVR1; KDF1; BMP10; SOX4; GPI; PRICKLE2; SULF1; DVL1; ALDH1A2; MSX1; JAG1; WNT2B; CYR61; LIAS; VCL; LUZP1; CFL1; HGF; FOXN1; PBX1; PCDH8; EXOC4; DKK1; RDH10; ARHGAP35; CTNNBIP1; WNT11	612	137
0.00466869399477	0.278423932779	GO:0098609	b	3	cell-cell adhesion	90; 182; 384; 604; 641; 653; 677; 64405; 857; 939; 947; 1002; 1016; 1326; 1445; 1465; 1826; 1949; 2294; 3315; 3491; 4092; 4602; 4838; 5074; 5100; 5341; 5607; 5777; 5818; 6469; 6591; 6722; 6793; 170692; 7122; 7414; 7471; 7474; 7477; 7525; 1540; 8631; 8651; 8763; 9069; 9093; 10049; 10457; 51441; 79576; 80149; 80762; 81704; 266727; 114798; 57451; 83706; 3037; 51176; 84059; 8851; 54549; 3707; 56339; 23654; 23767; 11141; 89780; 57662; 57689; 9746; 255743; 27286; 257194; 53834; 29091; 3170; 64881	CLDN12; EFNB3; DOCK8; ACVR1; CDH18; STK10; SMAD7; CD34; FGFRL1; GPNMB; STXBP6; SNAI2; LRRC4C; ADGRV1; MDGA1; MAP2K5; ADAMTS18; DSCAM; LEF1; YES1; CAV1; PLXNB2; MAP3K8; CLSTN3; SRF; IL1RAPL1; SLITRK1; DNAJB6; ZC3H12A; NDFIP1; NECTIN1; CDK5R1; FOXF1; SRPX2; NODAL; NEGR1; JAG1; TENM2; CDH4; HAS2; SDK2; SKAP1; CYR61; CSK; HSPB1; VCL; CDH22; CD27; ZFP36L1; BLM; FERMT3; FLRT3; ITPKB; SHH; PAWR; PLEK; PTPN6; WNT3A; PCDH8; DNAJA3; BMP5; MYB; SOCS1; YTHDF2; CAMSAP3; ARG2; METTL3; CD164; CLDN5; NPNT; NKAP; FOXA2; CYLD; PCDH20; CSRP1; WNT5A; BCL6; WNT1; WNT7B	819	96
0.00499372571382	0.645725446969	GO:1903555	b	5	regulation of tumor necrosis factor superfamily cytokine production	384; 197358; 947; 2693; 3315; 4157; 5777; 55773; 7057; 7474; 9261; 10417; 10457; 80149; 114609	MAPKAPK2; MC1R; HSPB1; WNT5A; ARG2; TIRAP; CD34; GPNMB; THBS1; TBC1D23; SPON2; ZC3H12A; GHSR; PTPN6; NLRC3	138	15
0.00525277902097	0.611336770335	GO:0002009	b	4	morphogenesis of an epithelium	90; 133; 182; 183; 388; 538; 653; 977; 1072; 1175; 1282; 1427; 1512; 1855; 1969; 2294; 166336; 2535; 2626; 2648; 2909; 3082; 3091; 3237; 3491; 3845; 4088; 4208; 4609; 4838; 4920; 5087; 5100; 5311; 5361; 5469; 56998; 6469; 6495; 6591; 6659; 55727; 6692; 6722; 6926; 6939; 7414; 7422; 7471; 7474; 7476; 7477; 7481; 7798; 7976; 8195; 23213; 8322; 8323; 170690; 8456; 8543; 8854; 55966; 9948; 10371; 10959; 11019; 7482; 79191; 79192; 81839; 83605; 51176; 51804; 85407; 54910; 55036; 55366; 22943; 219736; 23242; 23245; 23654; 23767; 25865; 89780; 57167; 153572; 57662; 255743; 157506; 27031; 64783; 126695; 63943; 64399	AGT; SPINT1; SIX4; SIX1; FOXF1; MKKS; IRX1; IRX3; IRX2; CTSH; WDR1; FLRT3; SNAI2; GATA4; CCDC40; ROR2; KRAS; BMP5; FKBPL; TCF15; WNT7A; WNT1; WNT7B; LGR4; KAT2A; CD151; MED1; VANGL1; ATP7A; PLXNB2; AP2S1; SEMA4C; AJAP1; CCM2; ASTN2; VEGFA; COL4A1; SHH; RHOB; CAMSAP3; HOXD11; MEF2C; WNT5A; HHIP; WNT3A; NODAL; CRYGS; EPHA2; SMAD3; NPHP3; TBX3; ADAMTS16; FZD2; FZD3; FZD4; TMED2; FZD6; STOX1; RBM15; NKD1; SRF; BTBD7; SALL4; HIF1A; LEF1; ADM; MYC; SEMA3A; PKD2; PLXNA1; LMO4; NPNT; COBL; PRKD2; ACVR1; KDF1; SOX4; PRICKLE2; SULF1; DVL1; ALDH1A2; JAG1; WNT2B; CYR61; LIAS; VCL; LUZP1; CFL1; HGF; FOXN1; PBX1; PCDH8; DKK1; RDH10; ARHGAP35; CTNNBIP1; WNT11	483	120
0.00573177852082	0.645725446969	GO:0090092	b	5	regulation of transmembrane receptor protein serine/threonine kinase signaling pathway	90; 91; 142; 651; 653; 857; 858; 1030; 1745; 2626; 3491; 3625; 4052; 4088; 4091; 4092; 135228; 4487; 4838; 6469; 7043; 7057; 7272; 7471; 7474; 23213; 8483; 9210; 10140; 114990; 51496; 22943; 23770; 168002; 26036; 255743; 27302	TGFB3; ACVR1; ACVR1B; NODAL; SMAD6; SMAD7; SMAD3; BMP10; BMP15; VASN; CAV2; CAV1; NPNT; ZNF451; TOB1; FKBP8; SULF1; THBS1; TTK; INHBB; MSX1; DACT2; DLX1; CDKN2B; CYR61; LTBP1; PARP1; SHH; GATA4; BMP5; BMP3; CTDSPL2; CD109; DKK1; CILP; WNT5A; WNT1	227	42
0.005815626135	0.31792089538	GO:0035239	b	3	tube morphogenesis	90; 133; 182; 183; 185; 285; 388; 577; 653; 677; 857; 947; 1072; 1282; 1295; 1386; 1512; 1855; 1870; 1969; 2034; 2050; 2294; 2321; 2535; 2624; 2626; 2627; 2648; 2693; 2909; 3082; 3091; 3198; 3237; 3315; 3397; 3398; 3491; 3845; 4086; 4088; 4092; 4208; 4215; 4313; 4327; 4609; 4643; 4780; 4838; 4915; 5087; 5140; 5311; 5469; 5607; 56998; 6469; 6495; 6659; 6692; 6722; 6899; 6926; 6932; 7057; 7422; 7453; 7471; 7474; 7476; 7477; 7481; 7798; 7857; 7976; 8038; 8195; 23213; 8322; 8323; 170690; 8456; 8543; 9037; 9270; 9475; 9982; 10352; 10365; 10457; 10769; 10959; 11019; 7482; 26051; 79191; 79192; 80149; 8325; 83605; 3037; 51176; 51804; 54910; 284361; 55036; 55366; 219736; 23242; 23462; 23654; 25865; 56999; 57007; 89780; 57167; 153572; 57493; 255743; 157506; 27031; 27035; 27286; 60675; 64783; 22846; 63943; 64102; 64220; 64399	PLK2; CD34; SCG2; TNMD; AGT; LEF1; CAV1; SPINT1; SIX4; MAP3K3; ADAMTS9; SIX1; NTRK2; FOXF1; FGFBP1; MKKS; IRX1; IRX3; IRX2; CTSH; STRA6; SMAD1; GATA6; GATA4; CCDC40; GATA2; KRAS; BMP5; FKBPL; WNT7A; WNT7B; LGR4; LMO4; MMP19; KAT2A; NOX1; MED1; HEG1; PLXNB2; SEMA4C; THBS1; ANGPT2; TCF7; EPHB4; CCM2; VEGFA; COL4A1; SHH; RHOB; EPAS1; SEMA5A; PROK2; HOXD11; MEF2C; NFE2L2; WNT5A; HHIP; WNT3A; PPP1R16B; NODAL; MYO1E; SMAD7; EPHA2; SMAD3; NPHP3; TBX3; TBX1; ADAMTS16; FLT1; FZD2; FZD3; FZD4; TMED2; FZD6; FZD8; GPNMB; PDE3B; STOX1; RBM15; AGTR1; HAS2; ADGRB3; SRF; SRPX2; ZFP36L1; SALL4; HIF1A; GHSR; ADM; MYC; HEY1; VASH1; PKD2; WNT1; ID2; ID1; NPNT; HOXA1; COBL; PRKD2; ACVR1; ADAM12; MAP2K5; ZC3H12A; ITGB1BP1; SOX4; WARS2; SULF1; DVL1; KLF2; JAG1; WNT2B; COL8A1; CYR61; LIAS; HSPB1; WARS; LUZP1; CFL1; HGF; EMC10; FOXN1; PBX1; E2F2; ROCK2; ACKR3; RDH10; ARHGAP35; CTNNBIP1; MMP2; WNT11; ATF2	809	167
0.00622512443409	0.645725446969	GO:0032774	b	5	RNA biosynthetic process	90; 91; 142; 182; 183; 257; 604; 641; 653; 675; 676; 677; 687; 708; 197358; 857; 862; 902; 905; 1024; 1030; 1063; 1108; 1386; 1428; 1479; 1611; 1653; 1663; 1745; 1746; 1810; 1820; 1822; 1855; 1869; 1870; 1871; 2034; 2103; 2130; 2145; 2186; 2202; 2274; 10987; 2294; 2298; 2308; 2309; 2313; 2354; 2516; 2535; 2624; 2626; 2627; 2636; 2648; 2909; 2957; 2958; 2967; 3068; 3082; 3091; 3094; 3198; 3206; 3216; 3221; 3227; 3229; 3235; 3236; 3237; 3238; 3397; 3398; 3491; 3607; 605; 3642; 3662; 3665; 3720; 3845; 3899; 4005; 4038; 4060; 4086; 4088; 4091; 4092; 4094; 4157; 4208; 4222; 4291; 4294; 4298; 4330; 4331; 4487; 4602; 4603; 4609; 4656; 4772; 4778; 4780; 4783; 4792; 4799; 4825; 4838; 4849; 4861; 4920; 4929; 4968; 164684; 5074; 5075; 5079; 5087; 5090; 5138; 5195; 5311; 5341; 5438; 5441; 5442; 5453; 5456; 5458; 5469; 5557; 5562; 5607; 5702; 5705; 22797; 5828; 6018; 6096; 56998; 6399; 170302; 6469; 6495; 6496; 6591; 6601; 6603; 6636; 6656; 6658; 6659; 6722; 6787; 6827; 6882; 6883; 6899; 6913; 6926; 6927; 6932; 6939; 170463; 7043; 7088; 7090; 7110; 7175; 7186; 7298; 55840; 7422; 55854; 7469; 7471; 7474; 7476; 7480; 7481; 7525; 7542; 7709; 7756; 7862; 7942; 7975; 8079; 23213; 8216; 8227; 8318; 8322; 8323; 8403; 8431; 8456; 8467; 8543; 8607; 8631; 121599; 8717; 8721; 8848; 9039; 9093; 205717; 9112; 9210; 9236; 9242; 83463; 9270; 9282; 9326; 83482; 9391; 9479; 23435; 9604; 9611; 140685; 9640; 9841; 9913; 9935; 9967; 9969; 9984; 22980; 10049; 10102; 10135; 10138; 10140; 10265; 10284; 10365; 10445; 730249; 10514; 10622; 11267; 10716; 10743; 10847; 10915; 10935; 11007; 11043; 11051; 11080; 11166; 11218; 11281; 11315; 400569; 59336; 7545; 56731; 23236; 144108; 1540; 79039; 79050; 390010; 79190; 79191; 79192; 79576; 79577; 440097; 79664; 472; 79809; 79831; 79902; 80149; 342371; 80298; 80312; 57106; 57117; 89887; 323; 81550; 343930; 114609; 114991; 128408; 57451; 8325; 345222; 116113; 148979; 345643; 50805; 83595; 83666; 116448; 51147; 83933; 51176; 51360; 84135; 84193; 51496; 51567; 84337; 84441; 51720; 51728; 51804; 100125288; 84627; 84632; 84662; 84969; 134353; 85416; 22828; 118472; 440275; 8851; 23051; 221937; 7251; 283571; 54386; 54626; 54765; 54796; 54927; 644815; 54997; 55022; 55140; 55170; 55366; 219409; 55646; 22893; 22904; 22936; 22943; 55756; 55827; 23118; 23119; 219736; 23152; 23300; 23379; 23429; 23462; 23636; 23678; 23764; 23770; 29841; 25833; 25865; 56919; 56949; 89780; 57109; 57167; 253782; 153572; 57473; 57474; 57521; 57616; 57621; 57673; 57801; 100131390; 6297; 58499; 11083; 25909; 25959; 26173; 25988; 26036; 26039; 26098; 9817; 255743; 59335; 26959; 27044; 26354; 27297; 27302; 27319; 27324; 27336; 387893; 266743; 168451; 60468; 403341; 126374; 64783; 83879; 114034; 28952; 29114; 3170; 105378952; 29893; 30012; 128553; 63906; 63951; 63978; 391723; 129685; 64216; 64763; 130557; 65123; 10891	SMARCC2; RNF14; NELFA; ACOD1; AGT; FKBP8; CDC73; NR0B2; APBB2; PRIM1; IRX5; IRX4; IRX6; IRX1; YAF2; IRX2; SP9; GPATCH3; SMARCD2; GATA6; GATA4; GATA2; TRAPPC2; ZBTB34; TCF15; MAF; ATMIN; TSG101; LGR4; HINFP; ACVR1B; CHCHD3; ZNF451; BACH2; GSX1; SOX14; ZIC5; ZIC1; ZNF513; ZNF511; HOXB6; BLM; HOXC13; VEGFA; ING4; MYBBP1A; HES2; HES4; TFB2M; TLE3; SMAD6; SMAD7; SMAD1; SMAD3; TAF12; TAF11; HINT1; HIC2; POLR2I; RBM15; ZC3H15; BEND3; WBP2NL; SPIC; LEF1; SCAF8; OLIG1; MSGN1; LMO2; RLF; LMO4; NPNT; IRX3; CDC45; WTIP; PRKD2; ZNF207; MCRS1; ZNF490; TAF8; MYOG; RPTOR; NFX1; TOB1; DDX11; SULF1; RAI1; HNF1A; KLF2; CNOT3; RYBP; PSMC3; PSMC5; KLF9; CYR61; ATN1; HGF; SOX21; E2F3; E2F2; E2F1; BNC2; DKK1; MAP3K10; ZNF469; CTNNBIP1; ZNF462; EWSR1; KLF18; AHCTF1; SCRT1; REXO4; NUDT21; GNL3; TSFM; NFE2L2; WNT10B; SIX1; SIX3; EAF2; FOXF1; HDGF; CDCA7; CDKN2B; TSC22D1; CENPF; TERF2IP; SNAI2; THOC1; JAG1; CYLD; WNT7A; NFATC1; FOXP4; NUP85; COPS5; ZNF592; MED1; DHX33; NEK4; RUVBL1; TIRAP; ESRRB; DDX54; TCF7; FZD2; SHH; FZD4; EPAS1; IRF7; IRF4; MEF2C; WNT3A; NODAL; ATM; TCERG1; C1QBP; MXD3; LUM; MLF1; INTS12; MLF2; ZBTB17; DNAJB6; TRADD; DNAJB4; USF3; CCPG1; TBX15; UTP15; DIDO1; ELP3; TET1; HIF1A; SND1; NAT14; THAP5; KEAP1; HOXA1; CDK8; XAB2; SRCAP; TGFB3; MTERF2; PRDX3; PRKAA1; EZH1; AKAP17A; GTF2A1; GTF2A2; MYBL1; SOX3; SOX1; ITGB1BP1; SMARCA5; UIMC1; ALX3; MED11; MED13; MED14; EDF1; ZBTB2; INTS1; NR4A2; INTS9; KDM8; PBX3; PBX1; TOE1; DDX20; EDRF1; CSTF3; TESC; TYMS; ARHGAP35; ZNF512B; POU2F3; BPTF; KMT5A; POLR3G; CCNT2; POLR3K; CAV1; CERS6; PARK7; RORB; POU6F2; ZNF574; BRDT; TAGLN3; MC1R; BRCA2; HOXD9; NFIL3; PRMT6; SETD3; ROR2; DNAJA3; NKAP; FOXA2; LYAR; PID1; HDAC10; LZTR1; MSANTD1; ZBTB24; HELT; SKAP1; KAT2A; CIAO1; ICE2; ICE1; MAML2; SUPT7L; AFF3; PPARGC1A; CDK5R1; NFE2; PLCB1; PARP9; TSHZ2; TSHZ3; PARP1; PAX5; PAX1; UBA3; HOXC11; ZNF618; INSM1; SIX4; NAMPT; TBX3; TBX1; MEOX1; ATXN1L; ZHX3; SS18L1; HOXA10; FHL2; STOX1; BCL7A; SRF; THRAP3; FOXD4; SALL4; HTATSF1; SALL2; PAWR; TARDBP; MYB; SGK3; LRP4; CTDSPL2; WNT1; EIF2AK4; CCDC85B; JARID2; BAHD1; FOXO3; FOXO1; RUNX1T1; MAP2K5; NOC4L; MID2; PEX14; YES1; NLRC3; FAM83G; NPAS4; MLLT1; NPAS1; SOX7; SOX4; ZNHIT3; POU3F1; POU3F4; PSMC3IP; MCIDAS; ARID3A; ARX; DMRTA1; HBP1; SLC2A4RG; KANK2; BCL6; TPR; ELOF1; MAFK; MAFB; OGG1; DVL1; SAP18; MYC; KRAS; TLE1; TDRD3; TMF1; FLI1; CRCP; TDP2; NKX6-1; BMP5; MBTPS2; DR1; SUPT4H1; NKX1-2; DDX1; CCNH; INTS3; FOXK2; AFAP1L2; GLIS2; GLIS1; HOXC4; CHD4; GTF2H3; NR5A1; MAFF; NUP62; DLX1; DLX2; TFEC; TFEB; EFEMP1; MN1; POLR2L; TRIM44; PLEK; PRDM14; PEX2; PRDM12; PRDM13; SPTY2D1; HOXD12; HOXD10; HOXD11; TOX3; TOX2; POLRMT; WNT5A; FOSB; TENM2; NCOR1; GBX1; ZNF628; FOXK1; FZD6; FZD8; SSBP4; TCF25; NFKBIA; ZGLP1; ZFP36L1; TBR1; ELL2; MNAT1; MAPK8IP1; PROX2; HEY1; PKD2; ID2; ID1; CIC; ACVR1; CCDC22; BMP10; BMP15; ZC3H12A; TLX3; MSC; GRHL1; BHLHE22; BHLHE23; LSM11; BRPF1; DAP; MSX1; MTA1; DCAF6; TRAF2; ZFPL1; CRYM; POU4F2; SNF8; SNRPF; FOXN1; DBX2; SBNO2; TAB2; TTC21B; PDE2A; ZBTB46; WNT11; ATF2	3705	582
0.00630212523318	0.645725446969	GO:1901342	b	5	regulation of vasculature development	133; 183; 185; 285; 388; 577; 947; 1386; 1512; 1870; 1969; 2321; 2624; 2626; 2627; 2693; 3082; 3091; 3315; 3397; 4086; 4215; 4772; 4780; 4838; 5140; 5607; 7057; 7422; 7453; 7474; 8038; 23213; 9037; 9270; 9475; 9982; 10365; 10457; 10769; 80149; 284361; 22846; 23462; 25865; 56999; 27286; 60675; 26051; 63943; 64102	NFATC1; PPP1R16B; NODAL; PLK2; CD34; EPHA2; HIF1A; GATA6; ADAM12; MAP2K5; ZC3H12A; AGT; ITGB1BP1; GATA4; FLT1; TNMD; MAP3K3; ADAMTS9; GPNMB; SULF1; PDE3B; KLF2; FGFBP1; ANGPT2; EMC10; ADGRB3; CTSH; VASH1; SRPX2; HSPB1; WARS; SMAD1; VEGFA; HGF; RHOB; GHSR; ADM; GATA2; WNT5A; HEY1; E2F2; SEMA5A; PROK2; FKBPL; ROCK2; ID1; NFE2L2; AGTR1; THBS1; PRKD2; ATF2	314	60
0.00688735798311	0.347546679763	GO:0048731	b	3	system development	90; 91; 102; 133; 64377; 142; 182; 183; 185; 257; 285; 384; 388; 393; 538; 577; 604; 641; 651; 653; 675; 677; 747; 94081; 64405; 857; 858; 867; 886; 899; 905; 939; 947; 1002; 1030; 1031; 1036; 1063; 1072; 1123; 1175; 1203; 1282; 1295; 1298; 1373; 1386; 1392; 1396; 1399; 1427; 1445; 1512; 1620; 1638; 1745; 1746; 1794; 1822; 1826; 1855; 1869; 1870; 1949; 1969; 2034; 2050; 2051; 2057; 54626; 2103; 2121; 2145; 2186; 2202; 125981; 2237; 2259; 2274; 2288; 2294; 2308; 2309; 2313; 2321; 2322; 166336; 2516; 2535; 2557; 170302; 2624; 2626; 2627; 2636; 2647; 2648; 2674; 2693; 2743; 2775; 2806; 2903; 2909; 2931; 23092; 3082; 3091; 3155; 3198; 3206; 3216; 3221; 3227; 3229; 3235; 3236; 3237; 3238; 3251; 3295; 3315; 3361; 3397; 3398; 3475; 3491; 55198; 3615; 3625; 3642; 3662; 3665; 3705; 3720; 3730; 3792; 3845; 3978; 3980; 4000; 4005; 4038; 4052; 4055; 4060; 4081; 4086; 4088; 4091; 4092; 4094; 4131; 135228; 4208; 4215; 4222; 4291; 4313; 4327; 4331; 4438; 4487; 4521; 4593; 4602; 4609; 4637; 4643; 4656; 4726; 4772; 4778; 4780; 4792; 4825; 4838; 4850; 4861; 4868; 4915; 4920; 4929; 4975; 5021; 5026; 5067; 5075; 5079; 5087; 5090; 5140; 5274; 5311; 5341; 5361; 202018; 5426; 5453; 5456; 5458; 5469; 55526; 5501; 5562; 5607; 5660; 22801; 5745; 5756; 5777; 5806; 5810; 5818; 5860; 6010; 6096; 6152; 6198; 6223; 56998; 6247; 6327; 6399; 6434; 6445; 6469; 6495; 6496; 6591; 6601; 6656; 6658; 6659; 55727; 6687; 6692; 6722; 6770; 137868; 170692; 6899; 6913; 6926; 6927; 6932; 6939; 6988; 6993; 7043; 7057; 7088; 7090; 7110; 7122; 7123; 7298; 7299; 7336; 7368; 7374; 55846; 7414; 7422; 7453; 7471; 7474; 7476; 7477; 7480; 7481; 7504; 7515; 1540; 94137; 7798; 7857; 7942; 7975; 7976; 401236; 8038; 8128; 8195; 23213; 8322; 8323; 8326; 170690; 8403; 8408; 8431; 8456; 8482; 8506; 8543; 8578; 8651; 8660; 8704; 8717; 8763; 8814; 8854; 8874; 8894; 9037; 9061; 9093; 205717; 9210; 9211; 9242; 9261; 9270; 56159; 83482; 9468; 9474; 9475; 9514; 55966; 140685; 9644; 140767; 7079; 9733; 9806; 9821; 9841; 9935; 9948; 9982; 22980; 10049; 10092; 10135; 10143; 10159; 10265; 1717; 10352; 10365; 10371; 10380; 10417; 10425; 10457; 730249; 10565; 10631; 10716; 10769; 10810; 10905; 10935; 10959; 11019; 11051; 11113; 11166; 11174; 11211; 11231; 11281; 11344; 51668; 51092; 7482; 26051; 51218; 59336; 51232; 7545; 340481; 23236; 79068; 79152; 79191; 79192; 51441; 462; 55773; 79576; 79577; 440026; 472; 79791; 79809; 79893; 80114; 80149; 342371; 80243; 145864; 57124; 51665; 80762; 23424; 343035; 56172; 323; 146862; 81532; 81565; 81610; 124925; 114569; 81839; 114609; 9833; 81930; 266727; 114798; 114990; 246329; 57451; 57465; 8325; 51399; 118427; 57611; 50805; 50814; 57622; 112724; 83605; 116448; 83716; 83742; 3037; 23035; 51052; 51062; 51150; 83931; 83933; 51176; 55170; 84059; 51335; 51360; 51374; 84189; 84277; 51567; 51715; 84530; 84541; 51804; 84662; 57801; 84747; 117531; 221662; 9373; 84976; 55898; 26153; 85407; 85416; 347730; 440275; 8851; 118856; 53358; 221937; 53904; 7251; 283571; 54328; 87178; 54541; 54549; 54674; 9529; 54796; 54820; 54886; 54888; 54910; 54949; 284361; 54997; 3707; 55012; 55036; 55118; 55140; 55366; 9258; 219409; 55646; 22943; 63915; 23105; 23118; 219736; 23152; 23212; 23242; 23287; 23380; 23462; 56339; 23654; 23764; 23767; 23770; 25807; 11141; 29841; 56704; 25865; 56920; 56949; 56999; 57007; 89780; 57167; 153572; 11075; 90167; 57493; 57561; 57662; 57689; 57721; 168002; 91584; 6297; 56034; 9746; 25825; 25884; 25949; 25959; 26018; 26039; 26045; 26086; 26263; 255743; 157506; 223117; 26528; 59335; 27031; 27035; 27077; 27129; 9984; 387597; 27151; 57643; 27257; 27286; 27289; 27302; 27319; 266743; 60412; 257194; 60675; 60682; 53834; 64783; 126695; 55840; 28988; 10296; 29114; 29123; 57715; 91543; 150465; 3170; 30012; 8643; 128506; 161357; 22846; 63943; 63951; 391723; 64102; 22904; 64131; 64220; 64343; 64399; 64434; 10743; 54434; 64759; 130557; 65082; 22903; 10891	SMARCC2; MUSK; CRKL; SCG2; ACOD1; FKBP4; JPH1; AGT; FKBP8; LEF1; SEMA4G; BLOC1S5; SDF4; BLOC1S1; CDC73; NR0B2; APBB2; ZSWIM5; IRX5; IRX4; IRX1; IRX3; KBTBD8; SLITRK6; WDR1; SLITRK1; CRTAC1; TNS3; IFRD1; GATA6; GATA4; GATA2; DBNL; FKBPL; TRAPPC2; TRAPPC4; TCF15; RHBDD3; MAF; PLXNA1; HHIP; MYO3A; LGR4; ACVR1B; NRSN1; EVC; MMP19; RAD1; SFXN1; FZD10; SEMA4C; GSX1; SOX14; TBC1D23; ZIC5; ZIC1; ZNF513; SDK2; HOXB6; BLM; CHST8; HOXC13; VEGFA; COL4A1; FTO; VASH1; CAMSAP3; BHLHE22; PSAP; CBL; MBTPS2; FBXO31; HES2; CRIP1; RPL24; TLE3; SMAD6; SMAD7; SMAD1; SMAD3; NPHP3; POLE; PTX3; INHBB; RBM15; SEZ6; ADGRB3; ILDR2; OCSTAMP; CHRDL2; MOB2; UBE2V2; OLIG1; SCARF1; LMO2; LMO4; NPNT; METTL14; OXTR; IRX2; PRKD2; ANKH; NDE1; MYOG; RS1; EIF2S2; ACER1; TMEM41B; MAB21L1; SULF1; RAI1; HNF1A; KLF2; JAG1; HSD17B4; TRA2B; CNOT4; SPON2; CYR61; ARIH2; LTBP1; KIF18A; ATN1; HGF; MMP21; BTBD7; SOX21; BACE2; RAB23; E2F2; E2F1; BNC2; STMND1; DKK1; RND1; CTNNBIP1; TDP2; NPAS4; PPP2R3C; TSG101; CDO1; SIDT2; DHTKD1; SCRT1; IMPDH2; NUDT21; CLSTN3; ADAMTS6; SIX4; NFE2L2; WNT10B; DYNLT1; SIX1; SIX3; EAF2; FOXF1; FGFBP1; NODAL; MKKS; RP1L1; CDH4; CDKN2B; CDKN2C; CENPF; XYLT1; ARRDC3; SNAI2; KRAS; LRRC4C; FA2H; CYLD; RHO; WNT7A; TCTA; WNT7B; NFATC1; STAR; NSDHL; TBR1; SEC63; CNTN3; MED1; MDGA1; MDGA2; VANGL1; ATP7A; TIRAP; POU3F4; FLT3; ITPKB; LRRTM1; LRRTM2; ANGPT2; CLDN5; ITPK1; TCF7; CSK; NUDT1; FZD2; SHH; EPOR; EPAS1; IRF7; RD3; SEMA5A; IRF4; MEF2C; FZD8; ISLR2; WNT3A; EFNB3; TMC1; CDKL1; ATM; TEX11; CCDC40; GABRA4; LUM; FLT1; MLF1; FBXO22; RPS6KB1; DNAJB6; TRADD; AZI2; USF3; NDFIP1; TBX15; HAS2; XK; RRS1; KIF26A; HIF1A; UNG; KEL; EXOC4; CD109; IRS2; OMP; HOXA1; COBL; SH3PXD2A; XAB2; HAPLN3; NKD1; TGFB3; PNPT1; MSH4; PRKAA1; EZH1; XRCC1; LGI1; GAL3ST1; SOX3; SOX1; ITGB1BP1; SOX4; ALX3; SCN2B; DVL1; ANOS1; RDH10; VASN; LIAS; NR4A2; VCL; WARS; LMNA; AGTPBP1; PBX3; PBX1; CRIM1; NSUN2; ROCK2; TESC; TYMS; ARHGAP35; PTCH2; MMP2; BPTF; FGFRL1; TAPT1; CD34; MYL6; TNMD; CHN1; ADGRV1; CCNT2; CAV2; GHSR; CAV1; LTBR; SERPINC1; MAP3K3; RORB; ATP6AP2; POU6F2; CLN5; MARVELD1; SRPX2; DCT; TAGLN3; CTSH; BRCA2; HOXD9; SHC3; HMGCL; CDH22; TBC1D24; PRMT6; POSTN; FLRT3; ROR2; MAN1A2; SEMA3D; DNAJA3; PCYT1B; NKAP; FOXA2; LYAR; HDAC10; TTL; ZBTB24; HELT; DOCK2; GNAO1; ATRAID; KAT2A; ITGA11; ARHGAP4; CRH; B9D1; AP2S1; PPARGC1A; BICC1; PRLH; CDK5R1; NFE2; B4GALT2; PLCB1; MAP1B; EPHB6; STK40; EPHB4; MAL2; PARP1; CCM2; PAX5; ASB1; PAX1; UNC119B; FRMD7; PTPN6; HOXC11; PROK2; LSM1; ST8SIA2; INSM1; MELK; ARHGEF7; AGTR1; GGNBP2; CIC; BAG5; ADAMTS9; MYO1E; CRYGS; NAMPT; OLFM3; TBX3; TBX1; ADAMTS16; ADAMTS18; MEOX1; DACT2; ATXN1L; HPRT1; GPNMB; SS18L1; PDE3B; FHL2; STOX1; CPAMD8; LIG1; SRF; PRDX3; SALL4; APPL2; KDF1; SALL2; PPP1R16B; MAEA; CNTNAP1; LRP4; WNT1; LRRN3; EIF2AK4; ATL1; PLXNA4; GPSM1; IL1RAPL1; CRISPLD2; JARID2; FOXO3; FOXO1; MAP2K5; ZC3H12A; RB1CC1; ALDH1A2; ANKRD11; PRICKLE2; WASF3; CLEC3B; P2RX5; CLEC3A; NPAS1; VPS33A; ATG5; SERPINI1; WNT2B; HSPB7; POU3F1; STAC3; HSPB1; CD27; SSH1; ZDHHC21; GPR173; BPNT1; PPP1CC; ARX; HES4; DMRTA1; SRRM4; HSPB11; KANK2; NDUFS6; RDH13; BCL6; TIMP4; GLRX5; PLK2; MFHAS1; DHCR7; LRFN1; MAFK; MAFB; THOC1; MAFF; TDRD7; SMAP1; SPINT1; STRA6; FSTL4; NTRK2; ARHGAP26; LIG3; GOT2; MYC; MYB; TLE1; DDIT4; TMF1; FLI1; EMC10; NEGR1; BMP3; SRGAP2; SEMA7A; BRINP1; NKX6-1; TWF1; BMP5; TWF2; SOCS1; GSK3A; CCNF; GFRA1; ELP3; CPS1; HTR5A; FOXK1; STMN2; GLIS2; NFKBIA; HOXC4; NOX1; PDGFC; FEN1; MAPKAPK2; HEG1; PLXNB2; PREX2; AJAP1; THBS1; NGRN; NR5A1; DLX1; DLX2; PLPPR1; TFEB; EFEMP1; DNAJC30; ARPC5; GLRB; NPHS1; SART3; RHOB; PLEK; PRDM12; PRDM13; LRIG1; SDHAF2; ARG2; HOXD12; HOXD10; HOXD11; RBM24; TYR; SPOCK2; WNT5A; BTBD3; UGT8; EPHA2; TENM2; NOM1; SYF2; HOXA10; GBX1; FZD3; FZD4; TMED2; FZD6; SGCG; FZD9; CD248; NECTIN1; SGCZ; TCF25; FGF14; DAGLA; ESRRB; SBNO2; QDPR; COL9A2; ZFP36L1; ARFGEF1; PHLPP2; MNAT1; ADM; PROX2; HEY1; SEMA3A; ITFG2; SEMA3G; YTHDF2; PKD2; METTL3; ID2; CCKAR; ID1; PTH1R; ACVR1; SPG7; UNC45A; RPS19; ADAM10; ADAM12; BMP10; BMP15; CIT; DSCAM; ACKR3; MSC; FAM83D; PAPSS1; GRHL1; WARS2; RSAD2; DISP1; MSX1; COL8A1; ULK1; POU4F2; LUZP1; CFL1; NDEL1; PLAA; FOXN1; DAZAP1; TLX3; TAB2; TTC21B; CD164; UNC45B; GRIN2A; ZBTB46; WNT11; ATF2	4713	813
0.00706753858922	0.611336770335	GO:0048514	b	4	blood vessel morphogenesis	90; 133; 182; 183; 185; 285; 388; 577; 677; 857; 947; 1282; 1295; 1386; 1512; 1870; 1969; 2034; 2050; 2294; 2321; 2624; 2626; 2627; 2693; 3082; 3091; 3198; 3315; 3397; 3491; 4086; 4092; 4215; 4313; 4327; 4643; 4780; 4838; 4915; 5140; 5311; 5469; 5607; 6469; 6495; 6659; 6722; 6899; 7057; 7422; 7453; 7474; 7476; 7477; 7481; 7857; 8038; 23213; 8322; 8456; 9037; 9270; 9475; 9982; 10352; 10365; 10457; 10769; 80149; 8325; 83605; 3037; 51176; 284361; 23462; 25865; 56999; 57007; 57493; 27035; 27286; 60675; 64783; 26051; 22846; 63943; 64102; 64220	PLK2; CD34; SCG2; TNMD; AGT; LEF1; CAV1; MAP3K3; ADAMTS9; SIX1; NTRK2; FOXF1; FGFBP1; PPP1R16B; CTSH; STRA6; EMC10; GATA6; GATA4; GATA2; FKBPL; WNT7A; WNT7B; MMP19; HIF1A; NOX1; MED1; THBS1; ANGPT2; EPHB4; CCM2; VEGFA; COL4A1; SHH; RHOB; EPAS1; VASH1; PROK2; NFE2L2; WNT5A; NODAL; MYO1E; SMAD7; EPHA2; TBX1; FLT1; FZD4; FZD8; GPNMB; PDE3B; RBM15; AGTR1; HAS2; ADGRB3; SRF; SRPX2; ZFP36L1; GHSR; ADM; HEY1; SEMA5A; PKD2; ID1; HOXA1; PRKD2; ACVR1; ADAM12; SMAD1; MAP2K5; ZC3H12A; ITGB1BP1; SOX4; WARS2; SULF1; KLF2; JAG1; COL8A1; CYR61; HEG1; HSPB1; WARS; HGF; FOXN1; E2F2; ROCK2; ACKR3; MMP2; WNT11; ATF2	576	110
0.00711746474565	0.611336770335	GO:0007589	b	4	body fluid secretion	538; 857; 1036; 2806; 2979; 3091; 4986; 5021; 5469; 6863; 7422; 9474; 462; 65267	SERPINC1; TAC1; ATG5; CDO1; HIF1A; OPRK1; MED1; VEGFA; WNK3; OXTR; GOT2; CAV1; ATP7A; GUCA1B	96	14
0.00711746474565	0.611336770335	GO:0009954	b	4	proximal/distal pattern formation	1745; 1746; 3206; 3227; 3235; 3236; 4038; 4838; 5087; 6496; 8854; 79191; 79192; 153572	HOXD9; LRP4; NODAL; IRX3; HOXD10; HOXA10; HOXC11; ALDH1A2; IRX2; SIX3; IRX1; DLX1; DLX2; PBX1	32	14
0.00711746474565	0.660837386037	GO:0051965	b	5	positive regulation of synapse assembly	577; 4915; 5021; 7336; 7476; 114798; 84189; 347730; 54674; 23767; 11141; 9746; 26045; 27286	SLITRK6; IL1RAPL1; SLITRK1; LRRTM2; LRRN3; NTRK2; FLRT3; LRRTM1; SRPX2; OXTR; UBE2V2; CLSTN3; WNT7A; ADGRB3	67	14
