p-value	q-value	term_goid	term_category	term_level	term_name	members_input_overlap	members_input_overlap_geneids	size	effective_size
3.75534057132e-05	0.0529127486499	GO:0051965	b	5	positive regulation of synapse assembly	4915; 5021; 7336; 7476; 9231; 441381; 114798; 84189; 347730; 54413; 54674; 22865; 23767; 23769; 11141; 9746; 26045; 26050; 158038; 27286; 94030	ENSG00000178235; ENSG00000174482; ENSG00000121871; ENSG00000102359; ENSG00000184564; ENSG00000131409; ENSG00000148053; ENSG00000139182; ENSG00000125848; ENSG00000169306; ENSG00000146006; ENSG00000151208; ENSG00000162951; ENSG00000169139; ENSG00000165300; ENSG00000126500; ENSG00000173114; ENSG00000180914; ENSG00000196338; ENSG00000154764; ENSG00000254402	67	22
0.000117175840181	0.0244897505978	GO:0007275	b	2	multicellular organism development	27319; 90; 91; 102; 142; 146; 147; 154; 182; 183; 185; 212; 257; 285; 347; 351; 357; 360; 367; 388; 393; 430; 474; 22931; 525; 537; 538; 604; 613; 639; 651; 653; 677; 708; 747; 94081; 64405; 857; 858; 863; 867; 899; 1002; 1027; 1030; 1044; 1046; 1072; 1129; 5653; 1175; 1268; 1282; 1295; 1298; 1316; 1364; 1373; 1381; 1385; 1386; 1392; 1418; 1427; 1445; 1466; 132612; 27330; 1594; 1605; 1620; 1634; 1638; 1644; 1653; 1663; 1716; 1745; 1746; 1794; 1808; 1822; 1826; 1828; 1870; 1910; 1943; 1949; 1969; 1978; 2012; 2016; 2050; 2057; 2069; 2103; 2121; 2125; 2132; 2186; 2202; 2237; 2255; 2260; 2273; 2274; 2294; 2309; 2313; 2321; 2322; 493856; 166336; 2557; 2624; 2626; 2627; 2636; 2647; 2648; 2670; 2674; 2676; 2692; 2743; 2775; 2821; 2823; 2887; 2903; 2909; 2931; 23092; 3050; 3082; 3146; 3155; 3164; 3196; 3198; 3206; 3216; 3221; 3222; 3227; 3251; 3274; 3295; 3315; 3361; 3397; 3418; 3488; 3491; 55198; 3549; 199699; 3593; 3615; 3642; 3655; 3665; 3720; 3726; 3730; 3736; 3792; 3798; 3845; 3956; 3978; 3984; 4000; 9821; 4017; 4038; 4052; 4055; 4060; 4081; 4086; 4088; 4091; 4092; 4094; 4131; 4148; 4162; 4168; 4170; 4208; 4215; 7779; 4291; 4303; 4313; 4327; 4330; 4331; 4343; 4438; 4478; 4488; 4521; 4593; 4602; 4609; 4633; 4637; 4643; 4644; 4656; 4751; 4772; 4778; 4780; 4792; 4825; 4838; 4849; 4850; 4851; 4854; 4861; 4868; 4884; 4915; 4929; 4975; 5021; 5026; 5063; 5067; 5075; 5087; 5090; 5100; 5140; 5167; 5175; 5274; 5311; 5317; 5341; 5361; 5362; 5376; 202018; 5426; 5453; 5454; 5458; 5469; 55526; 5501; 5564; 5607; 5626; 5702; 22801; 5744; 5745; 5756; 5777; 5798; 5810; 5813; 5818; 5860; 5923; 5961; 5977; 6010; 6096; 6097; 6143; 6159; 6198; 6223; 56998; 6247; 6277; 6326; 6327; 6439; 6445; 6455; 6469; 6495; 6496; 6507; 6513; 6591; 6601; 6615; 6656; 6658; 6659; 55727; 6687; 6692; 6722; 6778; 137868; 170692; 6853; 6872; 6910; 6926; 6927; 6932; 6939; 6993; 7043; 7050; 7057; 7088; 7090; 7110; 7122; 7123; 7134; 7150; 7248; 7291; 7298; 7299; 7320; 7336; 7368; 7374; 55846; 7399; 7425; 7453; 7469; 7474; 7476; 7477; 7481; 7484; 7504; 7535; 80139; 1540; 7709; 1285; 55905; 728661; 7798; 7855; 7857; 7942; 7976; 401236; 8038; 8178; 8195; 8202; 23213; 8313; 8322; 8323; 8324; 8326; 170690; 729230; 8403; 8408; 8431; 8452; 8481; 8482; 8506; 8533; 8543; 5740; 8578; 8642; 8660; 8692; 8704; 8717; 8721; 23303; 8787; 8814; 8817; 8894; 8994; 9037; 9093; 205717; 9143; 9211; 9231; 9261; 9270; 56159; 9294; 9369; 83482; 64689; 9468; 9474; 9475; 7044; 23429; 9514; 55966; 9572; 140685; 9644; 9658; 7079; 9745; 9806; 9825; 9935; 9948; 9982; 22980; 10049; 10059; 10143; 10159; 10184; 10203; 10234; 10265; 10267; 10319; 10352; 10365; 10371; 10395; 10398; 10417; 10425; 730249; 10479; 23603; 10565; 7223; 10631; 10660; 10716; 10769; 10810; 10818; 10882; 140679; 10905; 10935; 10959; 10991; 11019; 11051; 11061; 11081; 11113; 11166; 11211; 11231; 10194; 11334; 51668; 51092; 8701; 7482; 51218; 51222; 59336; 51232; 7545; 7286; 60436; 340481; 23236; 340533; 340719; 170302; 285220; 144347; 78987; 78989; 79068; 390010; 79094; 79152; 79191; 79192; 55012; 341405; 51441; 55773; 56975; 79576; 440026; 79621; 472; 51522; 79809; 79893; 79923; 80023; 80114; 80128; 80149; 342371; 80237; 145864; 113246; 23013; 57124; 51665; 23424; 343035; 441381; 56172; 323; 146862; 150094; 81532; 81551; 81565; 81610; 81616; 63826; 343930; 114569; 114609; 81848; 81930; 266727; 114771; 114788; 114798; 114990; 147906; 246329; 57451; 57465; 8325; 90268; 51399; 64711; 118427; 50509; 50805; 50814; 112724; 83605; 84936; 116443; 116448; 83716; 81029; 83742; 3037; 23035; 51050; 51052; 51062; 51150; 51176; 84059; 116844; 51374; 84189; 84277; 84296; 51552; 51621; 84530; 100289087; 51776; 51804; 100125288; 84747; 117531; 221662; 84816; 84879; 9373; 84894; 84976; 55898; 85360; 26153; 85407; 85416; 66037; 3339; 347730; 440275; 8851; 118856; 348262; 53358; 221937; 54626; 53904; 431707; 283571; 54328; 54360; 87178; 54413; 54456; 54510; 54541; 54549; 54558; 54674; 9529; 54768; 54796; 153572; 54880; 54886; 54910; 54997; 3707; 55036; 55118; 644943; 55329; 55366; 57496; 9258; 219409; 22865; 55646; 22943; 63915; 23105; 23135; 23152; 23212; 23242; 23271; 23287; 23380; 23440; 23452; 23462; 56339; 23654; 23767; 23769; 23770; 11141; 100132074; 56704; 25837; 55959; 286204; 56896; 56920; 56944; 56949; 253558; 57007; 57118; 57125; 57158; 57167; 57379; 11075; 90167; 57453; 57462; 57624; 57662; 57674; 57689; 57690; 57721; 100131390; 91584; 6297; 56034; 58158; 58190; 123920; 9746; 25825; 9771; 25884; 25946; 255324; 25949; 25959; 152006; 25988; 26018; 26037; 26045; 26050; 91663; 9817; 26263; 26281; 255743; 157506; 223117; 26523; 59335; 26585; 92140; 92162; 124936; 157922; 158038; 27019; 27031; 27042; 27077; 27129; 9984; 387597; 57643; 27253; 27257; 27286; 27289; 27302; 27341; 387914; 266743; 257194; 60675; 60682; 93650; 64783; 126695; 94030; 55840; 28988; 10296; 29114; 29127; 57715; 389827; 91543; 150465; 22809; 3170; 8643; 128553; 161357; 65125; 26115; 30812; 30819; 63827; 63943; 63951; 63978; 391723; 22904; 64131; 64220; 64327; 64343; 64399; 64412; 10743; 54434; 64651; 64759; 359845; 130557; 65082; 22903; 10891	ENSG00000119185; ENSG00000160007; ENSG00000230873; ENSG00000164930; ENSG00000138795; ENSG00000185650; ENSG00000049089; ENSG00000162065; ENSG00000066777; ENSG00000162063; ENSG00000101335; ENSG00000101447; ENSG00000080573; ENSG00000185129; ENSG00000154122; ENSG00000011114; ENSG00000169031; ENSG00000084112; ENSG00000154124; ENSG00000125285; ENSG00000106070; ENSG00000151239; ENSG00000170561; ENSG00000106078; ENSG00000137075; ENSG00000087494; ENSG00000143195; ENSG00000156150; ENSG00000173068; ENSG00000164683; ENSG00000160439; ENSG00000137558; ENSG00000111186; ENSG00000076248; ENSG00000167720; ENSG00000119608; ENSG00000176542; ENSG00000178573; ENSG00000171246; ENSG00000111676; ENSG00000111678; ENSG00000111679; ENSG00000165240; ENSG00000180730; ENSG00000057468; ENSG00000175707; ENSG00000132437; ENSG00000105971; ENSG00000147596; ENSG00000105974; ENSG00000182054; ENSG00000187821; ENSG00000105877; ENSG00000118733; ENSG00000008056; ENSG00000261678; ENSG00000143772; ENSG00000198513; ENSG00000102871; ENSG00000173114; ENSG00000011201; ENSG00000101384; ENSG00000102755; ENSG00000101438; ENSG00000166225; ENSG00000166888; ENSG00000147676; ENSG00000197594; ENSG00000054356; ENSG00000147571; ENSG00000166341; ENSG00000136574; ENSG00000179820; ENSG00000136104; ENSG00000177706; ENSG00000163217; ENSG00000177169; ENSG00000117411; ENSG00000054938; ENSG00000184486; ENSG00000184481; ENSG00000196116; ENSG00000162624; ENSG00000118260; ENSG00000108298; ENSG00000111276; ENSG00000118200; ENSG00000196562; ENSG00000100097; ENSG00000170365; ENSG00000108947; ENSG00000046651; ENSG00000151892; ENSG00000067082; ENSG00000105723; ENSG00000095777; ENSG00000163462; ENSG00000108641; ENSG00000196581; ENSG00000167740; ENSG00000120498; ENSG00000141519; ENSG00000073146; ENSG00000157150; ENSG00000109738; ENSG00000136237; ENSG00000164113; ENSG00000139719; ENSG00000170961; ENSG00000135100; ENSG00000081189; ENSG00000173641; ENSG00000075213; ENSG00000187266; ENSG00000008083; ENSG00000106128; ENSG00000078725; ENSG00000115170; ENSG00000161800; ENSG00000136531; ENSG00000088038; ENSG00000165699; ENSG00000197912; ENSG00000198597; ENSG00000114854; ENSG00000179348; ENSG00000163512; ENSG00000140553; ENSG00000180914; ENSG00000147536; ENSG00000134321; ENSG00000020426; ENSG00000175324; ENSG00000156574; ENSG00000183049; ENSG00000151379; ENSG00000069812; ENSG00000133107; ENSG00000172602; ENSG00000078808; ENSG00000155980; ENSG00000123607; ENSG00000198162; ENSG00000103653; ENSG00000111732; ENSG00000110395; ENSG00000090316; ENSG00000172789; ENSG00000053108; ENSG00000185482; ENSG00000148204; ENSG00000125863; ENSG00000116809; ENSG00000058335; ENSG00000072840; ENSG00000145632; ENSG00000113916; ENSG00000101882; ENSG00000174607; ENSG00000137868; ENSG00000112175; ENSG00000164976; ENSG00000159674; ENSG00000145220; ENSG00000159527; ENSG00000163637; ENSG00000111245; ENSG00000142192; ENSG00000021645; ENSG00000078579; ENSG00000133884; ENSG00000167081; ENSG00000150938; ENSG00000118513; ENSG00000184194; ENSG00000165272; ENSG00000184564; ENSG00000144655; ENSG00000155254; ENSG00000142513; ENSG00000095713; ENSG00000147065; ENSG00000169783; ENSG00000101115; ENSG00000101977; ENSG00000116874; ENSG00000196338; ENSG00000104435; ENSG00000154309; ENSG00000115380; ENSG00000100906; ENSG00000188613; ENSG00000196655; ENSG00000145388; ENSG00000114251; ENSG00000136280; ENSG00000166579; ENSG00000175325; ENSG00000167880; ENSG00000118004; ENSG00000116774; ENSG00000186260; ENSG00000130347; ENSG00000114383; ENSG00000133703; ENSG00000170921; ENSG00000149596; ENSG00000165300; ENSG00000197555; ENSG00000138085; ENSG00000172757; ENSG00000105220; ENSG00000197892; ENSG00000124151; ENSG00000087258; ENSG00000149577; ENSG00000132031; ENSG00000117425; ENSG00000114956; ENSG00000197956; ENSG00000144476; ENSG00000161270; ENSG00000173404; ENSG00000169840; ENSG00000197380; ENSG00000115956; ENSG00000128829; ENSG00000198492; ENSG00000185049; ENSG00000091409; ENSG00000182240; ENSG00000113430; ENSG00000134245; ENSG00000126500; ENSG00000167874; ENSG00000060237; ENSG00000146950; ENSG00000178053; ENSG00000138623; ENSG00000198689; ENSG00000151702; ENSG00000023287; ENSG00000182968; ENSG00000197256; ENSG00000080802; ENSG00000174482; ENSG00000148082; ENSG00000124212; ENSG00000253293; ENSG00000165821; ENSG00000148123; ENSG00000188338; ENSG00000040199; ENSG00000142178; ENSG00000135441; ENSG00000079215; ENSG00000139330; ENSG00000132640; ENSG00000143365; ENSG00000119396; ENSG00000143367; ENSG00000169184; ENSG00000167755; ENSG00000229544; ENSG00000167612; ENSG00000186298; ENSG00000134569; ENSG00000113722; ENSG00000036054; ENSG00000151208; ENSG00000171951; ENSG00000137764; ENSG00000134760; ENSG00000169306; ENSG00000141985; ENSG00000179284; ENSG00000103423; ENSG00000178235; ENSG00000112561; ENSG00000101493; ENSG00000164466; ENSG00000176410; ENSG00000170891; ENSG00000173821; ENSG00000148400; ENSG00000147883; ENSG00000138083; ENSG00000108231; ENSG00000077782; ENSG00000030304; ENSG00000128606; ENSG00000165804; ENSG00000176890; ENSG00000135049; ENSG00000144810; ENSG00000142798; ENSG00000185950; ENSG00000121871; ENSG00000261371; ENSG00000145354; ENSG00000130711; ENSG00000130656; ENSG00000112139; ENSG00000189143; ENSG00000122870; ENSG00000198900; ENSG00000140718; ENSG00000164199; ENSG00000183734; ENSG00000049323; ENSG00000198909; ENSG00000164741; ENSG00000064932; ENSG00000092020; ENSG00000185507; ENSG00000132692; ENSG00000104290; ENSG00000145819; ENSG00000146006; ENSG00000132510; ENSG00000123388; ENSG00000135744; ENSG00000149654; ENSG00000163914; ENSG00000081059; ENSG00000163251; ENSG00000254402; ENSG00000143013; ENSG00000154764; ENSG00000164690; ENSG00000011465; ENSG00000074181; ENSG00000149575; ENSG00000117394; ENSG00000079134; ENSG00000152270; ENSG00000163697; ENSG00000124882; ENSG00000108797; ENSG00000086598; ENSG00000182512; ENSG00000141448; ENSG00000152785; ENSG00000155363; ENSG00000071553; ENSG00000134516; ENSG00000111012; ENSG00000165916; ENSG00000171873; ENSG00000114745; ENSG00000187678; ENSG00000122180; ENSG00000126368; ENSG00000136110; ENSG00000171540; ENSG00000189306; ENSG00000105991; ENSG00000110400; ENSG00000105137; ENSG00000117305; ENSG00000166145; ENSG00000105993; ENSG00000166140; ENSG00000119048; ENSG00000182220; ENSG00000121897; ENSG00000131409; ENSG00000071677; ENSG00000182585; ENSG00000115461; ENSG00000140511; ENSG00000114999; ENSG00000125686; ENSG00000175183; ENSG00000119699; ENSG00000079785; ENSG00000176842; ENSG00000165819; ENSG00000137055; ENSG00000148053; ENSG00000172954; ENSG00000111725; ENSG00000168389; ENSG00000180828; ENSG00000168140; ENSG00000162244; ENSG00000125813; ENSG00000125812; ENSG00000170549; ENSG00000176749; ENSG00000147324; ENSG00000108370; ENSG00000070193; ENSG00000181072; ENSG00000076924; ENSG00000128886; ENSG00000132970; ENSG00000134531; ENSG00000198570; ENSG00000122025; ENSG00000081870; ENSG00000092964; ENSG00000089820; ENSG00000196781; ENSG00000095539; ENSG00000069188; ENSG00000080166; ENSG00000137573; ENSG00000004848; ENSG00000187616; ENSG00000177283; ENSG00000130584; ENSG00000171223; ENSG00000118689; ENSG00000111203; ENSG00000172260; ENSG00000163815; ENSG00000139613; ENSG00000124226; ENSG00000005513; ENSG00000088992; ENSG00000167005; ENSG00000189403; ENSG00000050030; ENSG00000132329; ENSG00000145088; ENSG00000162415; ENSG00000136279; ENSG00000131910; ENSG00000204103; ENSG00000145536; ENSG00000168875; ENSG00000145431; ENSG00000019991; ENSG00000057663; ENSG00000117597; ENSG00000168878; ENSG00000122691; ENSG00000168209; ENSG00000136205; ENSG00000072133; ENSG00000130751; ENSG00000163623; ENSG00000153993; ENSG00000142871; ENSG00000177084; ENSG00000091436; ENSG00000105372; ENSG00000079999; ENSG00000157423; ENSG00000083454; ENSG00000156427; ENSG00000118707; ENSG00000171634; ENSG00000110880; ENSG00000147383; ENSG00000140873; ENSG00000164916; ENSG00000160801; ENSG00000077498; ENSG00000158578; ENSG00000065526; ENSG00000139329; ENSG00000085741; ENSG00000182208; ENSG00000162040; ENSG00000153234; ENSG00000118946; ENSG00000174807; ENSG00000174804; ENSG00000144891; ENSG00000166426; ENSG00000183454; ENSG00000220201; ENSG00000254550; ENSG00000137834; ENSG00000183337; ENSG00000112305; ENSG00000074660; ENSG00000102104; ENSG00000134595; ENSG00000127528; ENSG00000089225; ENSG00000112658; ENSG00000113302; ENSG00000131094; ENSG00000131095; ENSG00000189431; ENSG00000139915; ENSG00000013573; ENSG00000050555; ENSG00000042753; ENSG00000125968; ENSG00000078687; ENSG00000142627; ENSG00000144747; ENSG00000010319; ENSG00000125841; ENSG00000168743; ENSG00000125848; ENSG00000076706; ENSG00000144749; ENSG00000113971; ENSG00000196576; ENSG00000152977; ENSG00000137845; ENSG00000077264; ENSG00000160789; ENSG00000115641; ENSG00000117650; ENSG00000139800; ENSG00000169926; ENSG00000131264; ENSG00000158955; ENSG00000122966; ENSG00000137440; ENSG00000144834; ENSG00000224470; ENSG00000129993; ENSG00000123342; ENSG00000180660; ENSG00000135638; ENSG00000146013; ENSG00000079432; ENSG00000150455; ENSG00000149311; ENSG00000109819; ENSG00000022267; ENSG00000091879; ENSG00000068001; ENSG00000169762; ENSG00000121039; ENSG00000168758; ENSG00000076356; ENSG00000107223; ENSG00000105701; ENSG00000266028; ENSG00000144355; ENSG00000187498; ENSG00000182463; ENSG00000179242; ENSG00000236424; ENSG00000157851; ENSG00000198963; ENSG00000152430; ENSG00000148848; ENSG00000161642; ENSG00000136997; ENSG00000057657; ENSG00000120149; ENSG00000015592; ENSG00000103489; ENSG00000111432; ENSG00000124216; ENSG00000136160; ENSG00000144791; ENSG00000185630; ENSG00000136044; ENSG00000107957; ENSG00000108443; ENSG00000106268; ENSG00000163536; ENSG00000165672; ENSG00000108561; ENSG00000166170; ENSG00000113456; ENSG00000103089; ENSG00000112619; ENSG00000127561; ENSG00000080224; ENSG00000112902; ENSG00000115085; ENSG00000140332; ENSG00000162951; ENSG00000106211; ENSG00000124766; ENSG00000025796; ENSG00000213139; ENSG00000122735; ENSG00000141002; ENSG00000131196; ENSG00000138136; ENSG00000177508; ENSG00000140807; ENSG00000111321; ENSG00000138035; ENSG00000267534; ENSG00000116044; ENSG00000187840; ENSG00000143384; ENSG00000148948; ENSG00000042781; ENSG00000166471; ENSG00000134013; ENSG00000143878; ENSG00000137801; ENSG00000154485; ENSG00000221866; ENSG00000111843; ENSG00000157219; ENSG00000137809; ENSG00000140931; ENSG00000134780; ENSG00000151552; ENSG00000196411; ENSG00000189058; ENSG00000176399; ENSG00000177479; ENSG00000065802; ENSG00000123307; ENSG00000105486; ENSG00000171236; ENSG00000167196; ENSG00000184221; ENSG00000165091; ENSG00000189184; ENSG00000143768; ENSG00000181192; ENSG00000113805; ENSG00000169139; ENSG00000102683; ENSG00000169136; ENSG00000169641; ENSG00000141161; ENSG00000174576; ENSG00000179041; ENSG00000162775; ENSG00000104369; ENSG00000146425; ENSG00000105983; ENSG00000107742; ENSG00000182621; ENSG00000168646; ENSG00000119715; ENSG00000128564; ENSG00000133835; ENSG00000145934; ENSG00000083799; ENSG00000145685; ENSG00000111262; ENSG00000103196; ENSG00000225663; ENSG00000081277; ENSG00000100490; ENSG00000163795; ENSG00000178882; ENSG00000132122; ENSG00000114554; ENSG00000163874; ENSG00000117614; ENSG00000136535; ENSG00000115297; ENSG00000177426; ENSG00000112238; ENSG00000150625; ENSG00000165694; ENSG00000134318; ENSG00000166509; ENSG00000136099; ENSG00000102794; ENSG00000102359; ENSG00000178035; ENSG00000175970; ENSG00000161381; ENSG00000007968; ENSG00000170385; ENSG00000178585; ENSG00000135111; ENSG00000144579; ENSG00000144460; ENSG00000185668; ENSG00000106683; ENSG00000172273; ENSG00000179981; ENSG00000143799; ENSG00000115844; ENSG00000108557; ENSG00000135503; ENSG00000163501; ENSG00000128242; ENSG00000115966; ENSG00000151348; ENSG00000123405; ENSG00000163703; ENSG00000188428; ENSG00000157483; ENSG00000151615; ENSG00000131711; ENSG00000198353; ENSG00000173402; ENSG00000133110; ENSG00000064989; ENSG00000130559; ENSG00000141030; ENSG00000107984; ENSG00000111704; ENSG00000118432; ENSG00000155760; ENSG00000125977; ENSG00000183779; ENSG00000099617; ENSG00000125878; ENSG00000197993; ENSG00000036257; ENSG00000076826; ENSG00000116039; ENSG00000186716; ENSG00000164796; ENSG00000138587; ENSG00000164900; ENSG00000121621; ENSG00000188064; ENSG00000168582; ENSG00000163602; ENSG00000112183; ENSG00000139182; ENSG00000102230; ENSG00000189339; ENSG00000109099; ENSG00000021826; ENSG00000109158; ENSG00000140105; ENSG00000123358; ENSG00000197535; ENSG00000087470; ENSG00000136859; ENSG00000101665; ENSG00000158480; ENSG00000126778; ENSG00000166949; ENSG00000019549; ENSG00000066735; ENSG00000175893; ENSG00000047597; ENSG00000170214; ENSG00000105656; ENSG00000128965; ENSG00000188763; ENSG00000204060; ENSG00000121807; ENSG00000108773; ENSG00000217236; ENSG00000130377; ENSG00000278311; ENSG00000099246; ENSG00000164161; ENSG00000100625; ENSG00000184113; ENSG00000168496; ENSG00000147649; ENSG00000162889; ENSG00000139767; ENSG00000183688; ENSG00000147133; ENSG00000071127; ENSG00000198785; ENSG00000172238; ENSG00000125798; ENSG00000165704; ENSG00000108511; ENSG00000113749; ENSG00000087245; ENSG00000185053; ENSG00000204315; ENSG00000167964; ENSG00000169083; ENSG00000163421; ENSG00000177103; ENSG00000092841; ENSG00000092847; ENSG00000171587; ENSG00000166923; ENSG00000120049; ENSG00000169252; ENSG00000205213; ENSG00000118762; ENSG00000103241	5289	1310
0.000127830141449	0.0328523463523	GO:0005509	m	5	calcium ion binding	182; 487; 794; 813; 867; 1002; 1004; 1016; 1373; 1605; 1606; 1828; 54947; 2060; 2202; 2643; 2979; 3339; 3549; 3954; 4017; 4038; 4052; 4053; 4054; 4148; 4632; 4633; 4635; 4637; 4644; 4851; 4854; 4924; 4925; 5100; 5167; 5311; 5321; 5332; 5470; 5816; 5955; 6277; 6282; 6469; 170392; 7057; 7123; 7134; 7184; 23213; 8642; 9489; 9651; 9727; 9806; 9813; 10398; 10516; 10518; 10905; 23236; 78987; 78989; 79158; 79174; 57124; 81579; 63826; 57451; 83543; 83849; 51150; 84059; 84467; 85407; 8851; 53353; 54510; 54550; 54997; 55118; 23105; 23245; 55959; 286204; 56975; 64123; 57575; 9746; 25891; 255743; 27253; 27328; 28227; 30819; 30820; 63941; 158158; 64405	ENSG00000087157; ENSG00000138650; ENSG00000132031; ENSG00000087253; ENSG00000101335; ENSG00000101333; ENSG00000102290; ENSG00000189184; ENSG00000172137; ENSG00000140092; ENSG00000117906; ENSG00000138315; ENSG00000167720; ENSG00000197956; ENSG00000111670; ENSG00000182621; ENSG00000145934; ENSG00000166598; ENSG00000134569; ENSG00000134760; ENSG00000101384; ENSG00000198336; ENSG00000197594; ENSG00000166341; ENSG00000177706; ENSG00000148400; ENSG00000118946; ENSG00000174807; ENSG00000136099; ENSG00000168056; ENSG00000196562; ENSG00000142798; ENSG00000070081; ENSG00000196296; ENSG00000163703; ENSG00000164199; ENSG00000149090; ENSG00000049323; ENSG00000125967; ENSG00000163501; ENSG00000168743; ENSG00000111245; ENSG00000149654; ENSG00000118004; ENSG00000164690; ENSG00000074181; ENSG00000173402; ENSG00000107742; ENSG00000163191; ENSG00000114854; ENSG00000162618; ENSG00000085832; ENSG00000065357; ENSG00000159658; ENSG00000119681; ENSG00000165105; ENSG00000078808; ENSG00000167393; ENSG00000139182; ENSG00000116711; ENSG00000198162; ENSG00000110395; ENSG00000095713; ENSG00000113361; ENSG00000053108; ENSG00000179242; ENSG00000021826; ENSG00000149527; ENSG00000197535; ENSG00000168924; ENSG00000090565; ENSG00000100362; ENSG00000163815; ENSG00000184164; ENSG00000142449; ENSG00000204176; ENSG00000103154; ENSG00000123739; ENSG00000148204; ENSG00000131979; ENSG00000126878; ENSG00000104805; ENSG00000176749; ENSG00000112599; ENSG00000128595; ENSG00000120049; ENSG00000156194; ENSG00000136425; ENSG00000115380; ENSG00000148219; ENSG00000140807; ENSG00000168530; ENSG00000137573; ENSG00000182132; ENSG00000145526; ENSG00000092841; ENSG00000134013; ENSG00000137801; ENSG00000168702; ENSG00000088992; ENSG00000118762	706	144
