p-value	q-value	term_goid	term_category	term_level	term_name	members_input_overlap	members_input_overlap_geneids	size	effective_size
0.00483708785139	0.319247798192	GO:0003700	m	2	DNA-binding transcription factor activity	27319; 142; 257; 367; 430; 474; 604; 639; 677; 687; 862; 863; 1044; 1046; 1316; 1385; 1386; 152815; 1745; 1746; 1810; 1820; 1831; 1870; 1871; 2016; 2077; 2103; 2294; 2309; 2313; 2354; 2624; 2626; 2627; 2636; 2909; 2971; 3164; 3196; 3198; 3206; 3216; 3221; 3222; 3227; 3397; 3607; 3642; 3665; 3720; 3726; 4086; 4088; 4091; 4092; 4094; 4208; 4303; 170463; 4488; 4602; 4609; 4656; 4772; 4778; 4780; 4783; 4799; 4825; 4841; 4851; 4861; 4929; 5075; 5087; 5090; 5341; 5453; 5454; 5458; 5626; 22797; 5813; 5977; 6018; 6096; 6097; 6495; 6496; 6591; 6601; 6615; 6656; 6658; 6659; 6722; 6778; 6827; 6872; 6883; 6910; 6926; 6927; 6932; 6939; 7050; 7291; 7474; 7709; 7756; 7942; 8202; 8216; 8242; 8403; 8431; 8467; 8543; 205717; 9112; 83482; 23435; 9572; 140685; 9658; 9745; 9935; 22980; 10265; 10365; 10660; 10664; 10716; 10725; 11166; 10194; 51222; 59336; 7545; 168451; 60436; 170302; 79050; 390010; 79177; 79190; 79191; 79192; 440097; 79923; 80152; 89887; 343930; 114991; 128408; 116115; 148979; 50805; 116448; 51176; 51621; 51804; 100125288; 84627; 84969; 85416; 118472; 23051; 221937; 54626; 431707; 283571; 54796; 153572; 25833; 54927; 219409; 23119; 23152; 23440; 23462; 100132074; 57167; 253782; 57473; 100131390; 6297; 58158; 58499; 25909; 25946; 25988; 26036; 59335; 26959; 27324; 266743; 403341; 114034; 55840; 127665; 22809; 3170; 29855; 128553; 30812; 63951; 63978; 391723; 64375; 64412; 10743; 64651; 22887; 64864; 130557	ENSG00000160007; ENSG00000117505; ENSG00000169635; ENSG00000177683; ENSG00000225614; ENSG00000161642; ENSG00000145088; ENSG00000173404; ENSG00000169840; ENSG00000204103; ENSG00000115956; ENSG00000136574; ENSG00000113430; ENSG00000105967; ENSG00000168875; ENSG00000184221; ENSG00000185129; ENSG00000152977; ENSG00000102901; ENSG00000174306; ENSG00000196700; ENSG00000151702; ENSG00000141568; ENSG00000169136; ENSG00000130751; ENSG00000182968; ENSG00000163623; ENSG00000156150; ENSG00000102908; ENSG00000164683; ENSG00000253293; ENSG00000165821; ENSG00000079102; ENSG00000176542; ENSG00000178573; ENSG00000125533; ENSG00000124444; ENSG00000119715; ENSG00000143365; ENSG00000147596; ENSG00000229544; ENSG00000119608; ENSG00000113722; ENSG00000162624; ENSG00000261678; ENSG00000131910; ENSG00000118707; ENSG00000163795; ENSG00000130511; ENSG00000102974; ENSG00000123388; ENSG00000115297; ENSG00000112242; ENSG00000164916; ENSG00000112561; ENSG00000184967; ENSG00000101493; ENSG00000185650; ENSG00000124191; ENSG00000105991; ENSG00000165030; ENSG00000125740; ENSG00000198597; ENSG00000153234; ENSG00000148400; ENSG00000010244; ENSG00000184486; ENSG00000184481; ENSG00000185668; ENSG00000139613; ENSG00000118260; ENSG00000220201; ENSG00000130711; ENSG00000137834; ENSG00000007968; ENSG00000138136; ENSG00000123411; ENSG00000170549; ENSG00000174576; ENSG00000127528; ENSG00000089225; ENSG00000135111; ENSG00000112658; ENSG00000177426; ENSG00000170365; ENSG00000159387; ENSG00000134595; ENSG00000126778; ENSG00000172273; ENSG00000117000; ENSG00000105722; ENSG00000143799; ENSG00000115844; ENSG00000182463; ENSG00000108557; ENSG00000179348; ENSG00000138795; ENSG00000176399; ENSG00000069812; ENSG00000148143; ENSG00000123307; ENSG00000105856; ENSG00000185507; ENSG00000147140; ENSG00000125968; ENSG00000123405; ENSG00000179930; ENSG00000116044; ENSG00000135100; ENSG00000081189; ENSG00000151615; ENSG00000124151; ENSG00000179981; ENSG00000198353; ENSG00000132773; ENSG00000086102; ENSG00000185610; ENSG00000170561; ENSG00000131264; ENSG00000125285; ENSG00000169926; ENSG00000111704; ENSG00000136535; ENSG00000129993; ENSG00000183734; ENSG00000126012; ENSG00000135638; ENSG00000169083; ENSG00000165804; ENSG00000141448; ENSG00000167625; ENSG00000125878; ENSG00000079432; ENSG00000157657; ENSG00000151379; ENSG00000166888; ENSG00000118900; ENSG00000164900; ENSG00000119138; ENSG00000122180; ENSG00000153207; ENSG00000180828; ENSG00000171540; ENSG00000197483; ENSG00000081059; ENSG00000144355; ENSG00000120948; ENSG00000005513; ENSG00000172789; ENSG00000120656; ENSG00000122691; ENSG00000123358; ENSG00000108511; ENSG00000139800; ENSG00000116809; ENSG00000198963; ENSG00000187821; ENSG00000177125; ENSG00000198815; ENSG00000213246; ENSG00000113916; ENSG00000101665; ENSG00000137709; ENSG00000136997; ENSG00000103460; ENSG00000057657; ENSG00000067082; ENSG00000124216; ENSG00000120149; ENSG00000166949; ENSG00000019549; ENSG00000008083; ENSG00000176842; ENSG00000198546; ENSG00000185630; ENSG00000173068; ENSG00000112200; ENSG00000172292; ENSG00000204060; ENSG00000133884; ENSG00000217236; ENSG00000167081; ENSG00000125813; ENSG00000125812; ENSG00000118513; ENSG00000100625; ENSG00000144655; ENSG00000116017; ENSG00000124766; ENSG00000101115; ENSG00000147133; ENSG00000174796; ENSG00000112238; ENSG00000141002; ENSG00000131196; ENSG00000114251; ENSG00000177508; ENSG00000172238; ENSG00000125798; ENSG00000175325; ENSG00000115966; ENSG00000106554; ENSG00000181827; ENSG00000130584; ENSG00000171223; ENSG00000118689; ENSG00000004848; ENSG00000138083; ENSG00000126368; ENSG00000099949; ENSG00000143013; ENSG00000153147; ENSG00000122034; ENSG00000174332; ENSG00000157514; ENSG00000182979; ENSG00000103241	1750	351
0.0050047099884	0.236222311453	GO:0071604	b	3	transforming growth factor beta production	1385; 1386; 2627; 3694; 4052; 4054; 4060; 4088; 4602; 7057; 7481; 10159	ENSG00000085741; ENSG00000141448; ENSG00000118260; ENSG00000137801; ENSG00000168056; ENSG00000118513; ENSG00000139329; ENSG00000115966; ENSG00000115221; ENSG00000182220; ENSG00000049323; ENSG00000166949	36	13
0.00504292585582	0.684472797907	GO:0030219	b	5	megakaryocyte differentiation	1030; 2313; 2624; 4208; 4343; 4778; 4850; 5469; 5777; 6722; 7057; 10398; 54997; 57690; 25946; 26523; 64783	ENSG00000080802; ENSG00000101335; ENSG00000162775; ENSG00000147883; ENSG00000078687; ENSG00000155363; ENSG00000092847; ENSG00000161642; ENSG00000088992; ENSG00000137801; ENSG00000151702; ENSG00000123405; ENSG00000125686; ENSG00000111679; ENSG00000179348; ENSG00000081189; ENSG00000112658	94	20
0.00559591942437	0.247619434528	GO:0032635	b	3	interleukin-6 production	351; 197358; 1445; 1535; 2069; 3082; 3146; 5777; 7291; 7474; 8692; 9261; 10365; 10417; 55773; 80149; 114609; 55765; 64343	ENSG00000159674; ENSG00000150455; ENSG00000163874; ENSG00000163362; ENSG00000127528; ENSG00000019991; ENSG00000114251; ENSG00000142192; ENSG00000103653; ENSG00000122691; ENSG00000036054; ENSG00000167984; ENSG00000051523; ENSG00000068001; ENSG00000111679; ENSG00000124882; ENSG00000162889; ENSG00000189403; ENSG00000163512	135	23
0.00593141694624	0.735495701334	GO:0043169	m	3	cation binding	47; 49; 90; 91; 102; 108; 113; 128; 132; 142; 182; 212; 285; 169355; 332; 351; 367; 10994; 65986; 478; 487; 538; 604; 635; 639; 677; 687; 747; 759; 767; 779; 794; 813; 64405; 862; 863; 867; 978; 1002; 1004; 1016; 1108; 1140; 1316; 1360; 1373; 1386; 1445; 55696; 1465; 1466; 1535; 27330; 1579; 1594; 1605; 1606; 1638; 1663; 152815; 1727; 1816; 1828; 54947; 2026; 2060; 2103; 2130; 2132; 2186; 2202; 2237; 2273; 2274; 493856; 2342; 493911; 166336; 2588; 2624; 2626; 2627; 2643; 2669; 2731; 2743; 2770; 2771; 2775; 2903; 2971; 2979; 3050; 3081; 3155; 3164; 3242; 3251; 3361; 3418; 3549; 3607; 3614; 3615; 3642; 3655; 3792; 3954; 3978; 3984; 4017; 4038; 4052; 4053; 4054; 4081; 4086; 4088; 4091; 4092; 4123; 4144; 4148; 4200; 4215; 4247; 4313; 4327; 4331; 4361; 4521; 4593; 4598; 4632; 4633; 4635; 4637; 4644; 4751; 4799; 4850; 4851; 4854; 4884; 4924; 4925; 4929; 4935; 5063; 5069; 5100; 5138; 5139; 5140; 5152; 5167; 5213; 5236; 5311; 5321; 5332; 5426; 5438; 5441; 5470; 55526; 5495; 5501; 5607; 22801; 5742; 5816; 5828; 5913; 5955; 5977; 6010; 6018; 6096; 6097; 6100; 6167; 6277; 6282; 6530; 6469; 6507; 6510; 6529; 170392; 6591; 6615; 6687; 6827; 170689; 170692; 6948; 6999; 7057; 7086; 7123; 7134; 7184; 7299; 7307; 7542; 171425; 1540; 7709; 7726; 55905; 7756; 7862; 50487; 8038; 23213; 8242; 170690; 8543; 5740; 8554; 8572; 8642; 8693; 8703; 8704; 8801; 8887; 8894; 8986; 8994; 9093; 9112; 9326; 9369; 83482; 64689; 9468; 9475; 9489; 23429; 9572; 9604; 140685; 9651; 9658; 7079; 9727; 9745; 9806; 9810; 9813; 10056; 10138; 10181; 10213; 10294; 10299; 10314; 10365; 284273; 10398; 10417; 10418; 10425; 10516; 10518; 10535; 10569; 10572; 10631; 10664; 10713; 10797; 10905; 10930; 11019; 11043; 11068; 11113; 11164; 11165; 11186; 11226; 10194; 11315; 11320; 57117; 10987; 51668; 51147; 202374; 340075; 51218; 51222; 59336; 7545; 168451; 23236; 79956; 340719; 84101; 78987; 78989; 79068; 79102; 79152; 79158; 79174; 79177; 374291; 79444; 56975; 112398; 79676; 79691; 79695; 112479; 79831; 79842; 79876; 79966; 112812; 80128; 80139; 80149; 80196; 80204; 80315; 26286; 89887; 57124; 80821; 113878; 55799; 150094; 81532; 81579; 63826; 81890; 114771; 114826; 114991; 246329; 57451; 148479; 148811; 57574; 116115; 148979; 83543; 84936; 116443; 23035; 83849; 51150; 84059; 84337; 51621; 134218; 51646; 51652; 84460; 84467; 51728; 51776; 100125288; 84618; 84627; 84675; 84816; 84909; 118490; 347527; 85407; 85416; 6120; 3339; 118472; 8851; 118856; 53349; 53353; 23051; 348654; 85437; 431707; 54205; 54456; 54487; 54510; 54550; 54765; 54796; 54836; 54901; 54997; 55012; 55034; 153364; 55118; 55120; 91107; 55148; 55239; 55520; 22843; 55646; 22944; 23024; 23105; 23119; 23120; 23135; 23245; 23287; 23300; 23590; 23760; 23770; 55959; 286204; 56897; 56952; 89846; 122622; 57094; 57167; 57379; 57473; 57575; 57674; 100131390; 6297; 58190; 9746; 58499; 25797; 11083; 91404; 25891; 25898; 25946; 152006; 25988; 26036; 26164; 91703; 255743; 59335; 9616; 125150; 26973; 26994; 27072; 57643; 56265; 27253; 27293; 27328; 26007; 64123; 158866; 6732; 60682; 403341; 64777; 28227; 114034; 28987; 10296; 197370; 29127; 127665; 91543; 29951; 128553; 65125; 652968; 30819; 30820; 30833; 63941; 63951; 63978; 162417; 64131; 64180; 158158; 64324; 64375; 64399; 64412; 10743; 64780; 64781; 130557; 27244; 27246; 65220; 196403	ENSG00000182463; ENSG00000172340; ENSG00000100523; ENSG00000162302; ENSG00000162300; ENSG00000185650; ENSG00000136574; ENSG00000101335; ENSG00000113924; ENSG00000101333; ENSG00000164949; ENSG00000159674; ENSG00000173068; ENSG00000168883; ENSG00000141101; ENSG00000111670; ENSG00000111674; ENSG00000171246; ENSG00000124444; ENSG00000165240; ENSG00000075643; ENSG00000182752; ENSG00000142178; ENSG00000147596; ENSG00000182054; ENSG00000168724; ENSG00000261678; ENSG00000080561; ENSG00000105409; ENSG00000101384; ENSG00000197594; ENSG00000166343; ENSG00000166341; ENSG00000177700; ENSG00000164610; ENSG00000164751; ENSG00000137075; ENSG00000100312; ENSG00000196562; ENSG00000123411; ENSG00000170365; ENSG00000117411; ENSG00000117000; ENSG00000114353; ENSG00000086589; ENSG00000163462; ENSG00000153002; ENSG00000149090; ENSG00000163743; ENSG00000140400; ENSG00000187048; ENSG00000157150; ENSG00000109738; ENSG00000180011; ENSG00000139168; ENSG00000102974; ENSG00000133742; ENSG00000151576; ENSG00000161980; ENSG00000107742; ENSG00000115170; ENSG00000161800; ENSG00000169926; ENSG00000197912; ENSG00000198597; ENSG00000091073; ENSG00000114854; ENSG00000126012; ENSG00000134321; ENSG00000167625; ENSG00000020426; ENSG00000085832; ENSG00000157657; ENSG00000125458; ENSG00000119681; ENSG00000078808; ENSG00000119138; ENSG00000065911; ENSG00000106348; ENSG00000112200; ENSG00000273611; ENSG00000198162; ENSG00000103653; ENSG00000242247; ENSG00000110395; ENSG00000090316; ENSG00000053108; ENSG00000185482; ENSG00000101181; ENSG00000106268; ENSG00000116809; ENSG00000102383; ENSG00000113916; ENSG00000067082; ENSG00000204176; ENSG00000103154; ENSG00000123091; ENSG00000145220; ENSG00000159527; ENSG00000123739; ENSG00000163637; ENSG00000116273; ENSG00000142192; ENSG00000021645; ENSG00000133884; ENSG00000100422; ENSG00000136014; ENSG00000156194; ENSG00000101115; ENSG00000068028; ENSG00000115380; ENSG00000188613; ENSG00000165966; ENSG00000163703; ENSG00000168530; ENSG00000115286; ENSG00000130347; ENSG00000145526; ENSG00000154485; ENSG00000145916; ENSG00000178498; ENSG00000069345; ENSG00000087157; ENSG00000197894; ENSG00000138650; ENSG00000132031; ENSG00000087253; ENSG00000144579; ENSG00000182208; ENSG00000091409; ENSG00000173402; ENSG00000060237; ENSG00000152977; ENSG00000139629; ENSG00000172137; ENSG00000140092; ENSG00000141568; ENSG00000117906; ENSG00000080802; ENSG00000124212; ENSG00000165821; ENSG00000148120; ENSG00000040199; ENSG00000079215; ENSG00000187231; ENSG00000175175; ENSG00000143365; ENSG00000166454; ENSG00000166598; ENSG00000169189; ENSG00000186298; ENSG00000134569; ENSG00000119411; ENSG00000137764; ENSG00000134760; ENSG00000103423; ENSG00000198336; ENSG00000101493; ENSG00000013561; ENSG00000111642; ENSG00000148400; ENSG00000116288; ENSG00000010244; ENSG00000138081; ENSG00000012963; ENSG00000030304; ENSG00000168056; ENSG00000135596; ENSG00000167720; ENSG00000135049; ENSG00000121440; ENSG00000103546; ENSG00000173456; ENSG00000145354; ENSG00000130711; ENSG00000130656; ENSG00000176055; ENSG00000164199; ENSG00000179348; ENSG00000049323; ENSG00000198909; ENSG00000176399; ENSG00000184990; ENSG00000111245; ENSG00000272325; ENSG00000132510; ENSG00000149654; ENSG00000163914; ENSG00000143013; ENSG00000164690; ENSG00000074181; ENSG00000132773; ENSG00000172572; ENSG00000149476; ENSG00000151657; ENSG00000152270; ENSG00000144362; ENSG00000105281; ENSG00000088882; ENSG00000182512; ENSG00000145284; ENSG00000141448; ENSG00000111012; ENSG00000162618; ENSG00000118322; ENSG00000165917; ENSG00000161653; ENSG00000114745; ENSG00000127955; ENSG00000105135; ENSG00000087263; ENSG00000147573; ENSG00000166140; ENSG00000121897; ENSG00000119514; ENSG00000213246; ENSG00000160201; ENSG00000179930; ENSG00000175183; ENSG00000071073; ENSG00000139800; ENSG00000177706; ENSG00000131473; ENSG00000124226; ENSG00000141012; ENSG00000103489; ENSG00000101191; ENSG00000176749; ENSG00000101197; ENSG00000112599; ENSG00000185100; ENSG00000106052; ENSG00000165861; ENSG00000213339; ENSG00000174796; ENSG00000112238; ENSG00000102230; ENSG00000158825; ENSG00000137573; ENSG00000130584; ENSG00000183779; ENSG00000168906; ENSG00000163815; ENSG00000267673; ENSG00000148459; ENSG00000117305; ENSG00000168702; ENSG00000121022; ENSG00000080546; ENSG00000142798; ENSG00000159176; ENSG00000225614; ENSG00000145536; ENSG00000157103; ENSG00000158850; ENSG00000205667; ENSG00000087258; ENSG00000178295; ENSG00000114395; ENSG00000105258; ENSG00000089685; ENSG00000072133; ENSG00000081307; ENSG00000003756; ENSG00000138315; ENSG00000079102; ENSG00000132744; ENSG00000115828; ENSG00000197956; ENSG00000185339; ENSG00000177084; ENSG00000166106; ENSG00000091436; ENSG00000015153; ENSG00000171634; ENSG00000115233; ENSG00000140718; ENSG00000140873; ENSG00000077498; ENSG00000158578; ENSG00000185670; ENSG00000153234; ENSG00000124535; ENSG00000118946; ENSG00000174807; ENSG00000183454; ENSG00000220201; ENSG00000137834; ENSG00000112305; ENSG00000262655; ENSG00000111653; ENSG00000127528; ENSG00000070081; ENSG00000196296; ENSG00000013573; ENSG00000205189; ENSG00000165105; ENSG00000008130; ENSG00000125967; ENSG00000148143; ENSG00000168743; ENSG00000110172; ENSG00000186642; ENSG00000116120; ENSG00000137845; ENSG00000077264; ENSG00000131435; ENSG00000115641; ENSG00000177683; ENSG00000117650; ENSG00000086102; ENSG00000130768; ENSG00000006715; ENSG00000166326; ENSG00000122966; ENSG00000163191; ENSG00000129993; ENSG00000123342; ENSG00000180660; ENSG00000159658; ENSG00000022267; ENSG00000091879; ENSG00000100078; ENSG00000196700; ENSG00000188676; ENSG00000130165; ENSG00000197483; ENSG00000165609; ENSG00000095713; ENSG00000095303; ENSG00000127084; ENSG00000179242; ENSG00000149527; ENSG00000152556; ENSG00000198963; ENSG00000148848; ENSG00000099256; ENSG00000161642; ENSG00000162624; ENSG00000184164; ENSG00000057657; ENSG00000142449; ENSG00000073146; ENSG00000124216; ENSG00000162415; ENSG00000144791; ENSG00000165078; ENSG00000151790; ENSG00000234127; ENSG00000020922; ENSG00000165671; ENSG00000125812; ENSG00000104805; ENSG00000128191; ENSG00000103089; ENSG00000160191; ENSG00000169302; ENSG00000088992; ENSG00000051523; ENSG00000136425; ENSG00000145592; ENSG00000101850; ENSG00000173821; ENSG00000165804; ENSG00000111325; ENSG00000140807; ENSG00000138032; ENSG00000116981; ENSG00000138785; ENSG00000126368; ENSG00000182132; ENSG00000080166; ENSG00000198546; ENSG00000134013; ENSG00000122034; ENSG00000137801; ENSG00000158104; ENSG00000141096; ENSG00000157219; ENSG00000137809; ENSG00000134780; ENSG00000141642; ENSG00000239282; ENSG00000177479; ENSG00000169635; ENSG00000105486; ENSG00000257594; ENSG00000168282; ENSG00000148204; ENSG00000102290; ENSG00000189184; ENSG00000181192; ENSG00000174306; ENSG00000119801; ENSG00000170633; ENSG00000164609; ENSG00000078295; ENSG00000099219; ENSG00000121281; ENSG00000182621; ENSG00000119715; ENSG00000214941; ENSG00000145934; ENSG00000083799; ENSG00000100243; ENSG00000114125; ENSG00000162877; ENSG00000163795; ENSG00000125246; ENSG00000163874; ENSG00000133110; ENSG00000132481; ENSG00000081870; ENSG00000111732; ENSG00000136099; ENSG00000178035; ENSG00000182944; ENSG00000172115; ENSG00000196678; ENSG00000257365; ENSG00000145495; ENSG00000106683; ENSG00000172273; ENSG00000179981; ENSG00000143799; ENSG00000145692; ENSG00000108557; ENSG00000135503; ENSG00000163501; ENSG00000166432; ENSG00000144583; ENSG00000177125; ENSG00000151348; ENSG00000118004; ENSG00000180957; ENSG00000173404; ENSG00000169676; ENSG00000265491; ENSG00000103549; ENSG00000269858; ENSG00000178445; ENSG00000125977; ENSG00000079739; ENSG00000197993; ENSG00000065357; ENSG00000096063; ENSG00000156983; ENSG00000163602; ENSG00000139182; ENSG00000116711; ENSG00000156110; ENSG00000113361; ENSG00000178538; ENSG00000021826; ENSG00000123358; ENSG00000197535; ENSG00000168924; ENSG00000090565; ENSG00000100362; ENSG00000163931; ENSG00000101665; ENSG00000092020; ENSG00000166949; ENSG00000019549; ENSG00000115392; ENSG00000033800; ENSG00000145996; ENSG00000082212; ENSG00000104889; ENSG00000131979; ENSG00000126878; ENSG00000217236; ENSG00000164161; ENSG00000128595; ENSG00000115365; ENSG00000155666; ENSG00000105701; ENSG00000168496; ENSG00000081248; ENSG00000167393; ENSG00000110921; ENSG00000170175; ENSG00000148219; ENSG00000124701; ENSG00000198785; ENSG00000165704; ENSG00000115966; ENSG00000087245; ENSG00000134318; ENSG00000113742; ENSG00000169083; ENSG00000174332; ENSG00000092841; ENSG00000186532; ENSG00000120049; ENSG00000157445; ENSG00000197713; ENSG00000115561; ENSG00000118762; ENSG00000182979; ENSG00000183876	4290	849
0.00610126904607	0.451815028832	GO:0048568	b	4	embryonic organ development	90; 257; 430; 474; 525; 613; 639; 653; 677; 1046; 1746; 1969; 2103; 2186; 2202; 2255; 2260; 2294; 2624; 2626; 3198; 3216; 3221; 3227; 3491; 3549; 3726; 4088; 4208; 4838; 4851; 5087; 5311; 5426; 5469; 6469; 6495; 6496; 6615; 6692; 6722; 6926; 6932; 55773; 7043; 7291; 7474; 7477; 7481; 7484; 7855; 7942; 7976; 8195; 8323; 9935; 10049; 10265; 10660; 10818; 10959; 10194; 7545; 79893; 50814; 51176; 84189; 51804; 53904; 55036; 23242; 23462; 286204; 57453; 56034; 25949; 26018; 157506; 27031; 64220	ENSG00000163501; ENSG00000115380; ENSG00000176842; ENSG00000198353; ENSG00000185630; ENSG00000278311; ENSG00000164930; ENSG00000112561; ENSG00000166225; ENSG00000131264; ENSG00000115170; ENSG00000188064; ENSG00000185650; ENSG00000136574; ENSG00000125863; ENSG00000179348; ENSG00000086598; ENSG00000152977; ENSG00000036054; ENSG00000177084; ENSG00000070193; ENSG00000138083; ENSG00000184564; ENSG00000144749; ENSG00000100625; ENSG00000077782; ENSG00000156574; ENSG00000147383; ENSG00000204103; ENSG00000148400; ENSG00000138136; ENSG00000116039; ENSG00000186716; ENSG00000106078; ENSG00000113971; ENSG00000135111; ENSG00000112658; ENSG00000156150; ENSG00000164683; ENSG00000142871; ENSG00000085741; ENSG00000114251; ENSG00000172238; ENSG00000105993; ENSG00000179981; ENSG00000163251; ENSG00000105991; ENSG00000095777; ENSG00000108511; ENSG00000115844; ENSG00000138795; ENSG00000145431; ENSG00000119699; ENSG00000166145; ENSG00000183734; ENSG00000158955; ENSG00000122691; ENSG00000119715; ENSG00000142627; ENSG00000141519; ENSG00000121039; ENSG00000177103; ENSG00000104290; ENSG00000081059; ENSG00000166949; ENSG00000171223; ENSG00000137868; ENSG00000126778; ENSG00000081189; ENSG00000057657; ENSG00000171634; ENSG00000112175; ENSG00000125686; ENSG00000124216; ENSG00000148204; ENSG00000118762; ENSG00000117614; ENSG00000123388; ENSG00000164690; ENSG00000103241	424	120
