p-value	q-value	term_goid	term_category	term_level	term_name	members_input_overlap	members_input_overlap_geneids	size	effective_size
0.000884517986285	0.140044437735	GO:0048468	b	3	cell development	90; 102; 182; 183; 285; 347; 351; 367; 393; 430; 474; 537; 538; 604; 639; 651; 653; 708; 858; 1002; 1072; 1140; 5653; 1268; 1385; 132612; 1605; 1620; 1638; 1716; 1745; 1746; 1808; 1826; 1910; 1943; 1949; 1969; 2016; 2050; 2069; 54626; 2260; 2274; 2309; 2313; 170302; 2624; 2626; 2636; 2647; 2670; 2674; 2676; 2692; 2775; 2823; 2887; 2909; 2931; 3050; 3082; 3146; 3196; 3251; 3274; 3295; 3397; 3418; 55198; 3549; 3626; 3642; 3730; 3792; 3798; 3845; 3956; 3984; 4000; 4038; 4088; 4094; 4131; 4148; 4168; 4208; 4343; 4478; 4488; 4602; 4633; 4643; 4656; 4780; 4825; 4838; 4851; 4854; 4868; 4884; 4915; 4929; 5063; 5087; 5090; 5138; 5139; 5175; 5274; 5361; 5362; 5376; 202018; 5453; 5454; 5458; 5469; 5501; 5744; 5745; 5756; 5777; 5818; 5923; 6096; 6198; 6223; 6277; 6469; 6495; 6496; 6507; 6591; 6656; 6658; 6659; 6692; 6722; 137868; 6853; 6926; 6993; 7043; 7110; 7122; 7248; 7291; 7298; 7320; 7336; 7368; 7474; 7476; 7477; 7504; 7855; 7976; 50487; 401236; 8195; 23213; 8313; 8322; 8324; 729230; 8403; 8408; 8452; 8482; 8506; 8578; 8660; 23303; 8817; 8994; 9037; 9211; 9231; 9270; 9294; 9369; 83482; 64689; 9474; 9475; 7044; 9745; 9948; 10059; 10265; 10319; 10365; 10371; 10417; 10425; 10479; 23603; 10565; 10631; 10660; 10716; 10769; 10810; 10818; 10882; 10979; 11061; 11218; 11334; 51092; 60436; 340533; 340719; 285220; 144347; 79152; 79191; 51441; 374308; 55773; 56975; 79989; 80005; 80128; 80237; 113246; 23013; 26509; 323; 81532; 81551; 81565; 114788; 114798; 128408; 246329; 57451; 57465; 51399; 118427; 112724; 83605; 116443; 83706; 81029; 3037; 51062; 51176; 84059; 84189; 84530; 51804; 100125288; 117531; 84816; 84879; 9373; 84894; 66037; 440275; 8851; 53358; 431707; 283571; 54328; 54413; 54456; 5819; 9529; 54768; 54910; 55118; 644943; 22865; 55646; 22943; 63915; 23105; 23242; 23271; 23380; 23440; 23462; 56339; 23654; 23767; 23769; 11141; 100132074; 55959; 56896; 56920; 57118; 11075; 90167; 57453; 57462; 57624; 57662; 57689; 91584; 58158; 58190; 25809; 25825; 25946; 26037; 26050; 91663; 26263; 26281; 124540; 157506; 223117; 59335; 124936; 157777; 157922; 57643; 27257; 27289; 27302; 257194; 6732; 93650; 126695; 28988; 10296; 57715; 150465; 22809; 65125; 30812; 30819; 63978; 391723; 54434; 359845; 65082; 22903	ENSG00000196411; ENSG00000189058; ENSG00000019549; ENSG00000160007; ENSG00000230873; ENSG00000087258; ENSG00000177479; ENSG00000132031; ENSG00000153944; ENSG00000123307; ENSG00000114956; ENSG00000197956; ENSG00000136279; ENSG00000161270; ENSG00000169306; ENSG00000173404; ENSG00000163217; ENSG00000125848; ENSG00000166145; ENSG00000136574; ENSG00000064703; ENSG00000162065; ENSG00000066777; ENSG00000167196; ENSG00000182240; ENSG00000168875; ENSG00000172602; ENSG00000167740; ENSG00000126500; ENSG00000019991; ENSG00000060237; ENSG00000057663; ENSG00000071127; ENSG00000084112; ENSG00000196655; ENSG00000089820; ENSG00000125863; ENSG00000138623; ENSG00000106070; ENSG00000198689; ENSG00000144460; ENSG00000151239; ENSG00000151702; ENSG00000151892; ENSG00000169783; ENSG00000106078; ENSG00000157851; ENSG00000087494; ENSG00000163623; ENSG00000144579; ENSG00000159674; ENSG00000164683; ENSG00000160439; ENSG00000130202; ENSG00000165300; ENSG00000198785; ENSG00000146425; ENSG00000176890; ENSG00000148082; ENSG00000119608; ENSG00000130559; ENSG00000178573; ENSG00000105971; ENSG00000135441; ENSG00000171246; ENSG00000079215; ENSG00000111678; ENSG00000111679; ENSG00000165240; ENSG00000168646; ENSG00000120049; ENSG00000105372; ENSG00000189431; ENSG00000198492; ENSG00000147459; ENSG00000133835; ENSG00000153993; ENSG00000145934; ENSG00000167755; ENSG00000182054; ENSG00000177169; ENSG00000186298; ENSG00000187821; ENSG00000134569; ENSG00000105948; ENSG00000008056; ENSG00000036054; ENSG00000151208; ENSG00000261678; ENSG00000138795; ENSG00000118707; ENSG00000198513; ENSG00000261371; ENSG00000178882; ENSG00000198963; ENSG00000114554; ENSG00000011201; ENSG00000101384; ENSG00000188428; ENSG00000166225; ENSG00000115297; ENSG00000154764; ENSG00000167081; ENSG00000132640; ENSG00000150625; ENSG00000160801; ENSG00000169136; ENSG00000171540; ENSG00000065526; ENSG00000164976; ENSG00000128829; ENSG00000179820; ENSG00000177706; ENSG00000198597; ENSG00000134318; ENSG00000121871; ENSG00000153234; ENSG00000156427; ENSG00000148400; ENSG00000174804; ENSG00000184486; ENSG00000138083; ENSG00000108231; ENSG00000118260; ENSG00000077782; ENSG00000130711; ENSG00000118200; ENSG00000138136; ENSG00000074660; ENSG00000134595; ENSG00000127528; ENSG00000149577; ENSG00000100097; ENSG00000135111; ENSG00000112658; ENSG00000185950; ENSG00000165694; ENSG00000131094; ENSG00000131095; ENSG00000182208; ENSG00000185668; ENSG00000108947; ENSG00000130656; ENSG00000106683; ENSG00000126778; ENSG00000105723; ENSG00000163462; ENSG00000125968; ENSG00000157423; ENSG00000164199; ENSG00000179348; ENSG00000080166; ENSG00000183049; ENSG00000163501; ENSG00000142627; ENSG00000144747; ENSG00000010319; ENSG00000073146; ENSG00000152430; ENSG00000104290; ENSG00000164113; ENSG00000178460; ENSG00000111245; ENSG00000104435; ENSG00000186642; ENSG00000139719; ENSG00000135744; ENSG00000115844; ENSG00000196576; ENSG00000162624; ENSG00000118733; ENSG00000111186; ENSG00000137845; ENSG00000077264; ENSG00000160789; ENSG00000157483; ENSG00000172757; ENSG00000131711; ENSG00000074181; ENSG00000036257; ENSG00000146013; ENSG00000075213; ENSG00000173402; ENSG00000172572; ENSG00000133110; ENSG00000106128; ENSG00000078725; ENSG00000115170; ENSG00000107984; ENSG00000119185; ENSG00000165699; ENSG00000136535; ENSG00000118432; ENSG00000163697; ENSG00000124882; ENSG00000108797; ENSG00000183734; ENSG00000155760; ENSG00000135638; ENSG00000169083; ENSG00000165819; ENSG00000099617; ENSG00000143768; ENSG00000152785; ENSG00000155363; ENSG00000156574; ENSG00000071553; ENSG00000197993; ENSG00000169139; ENSG00000076826; ENSG00000069812; ENSG00000164796; ENSG00000091879; ENSG00000100078; ENSG00000164900; ENSG00000169762; ENSG00000122180; ENSG00000137055; ENSG00000168758; ENSG00000188064; ENSG00000076356; ENSG00000136110; ENSG00000182077; ENSG00000145220; ENSG00000266028; ENSG00000144355; ENSG00000096063; ENSG00000095713; ENSG00000109099; ENSG00000090316; ENSG00000087470; ENSG00000053108; ENSG00000179242; ENSG00000122691; ENSG00000177103; ENSG00000078579; ENSG00000119048; ENSG00000058335; ENSG00000175707; ENSG00000182968; ENSG00000145632; ENSG00000113916; ENSG00000174607; ENSG00000161642; ENSG00000175189; ENSG00000081189; ENSG00000057657; ENSG00000155980; ENSG00000138119; ENSG00000112175; ENSG00000125686; ENSG00000162415; ENSG00000120149; ENSG00000015592; ENSG00000166949; ENSG00000119699; ENSG00000115641; ENSG00000185482; ENSG00000176842; ENSG00000136160; ENSG00000144791; ENSG00000185630; ENSG00000047597; ENSG00000136044; ENSG00000148053; ENSG00000142192; ENSG00000021645; ENSG00000108443; ENSG00000163536; ENSG00000168389; ENSG00000204060; ENSG00000121807; ENSG00000197892; ENSG00000108561; ENSG00000114999; ENSG00000166170; ENSG00000165091; ENSG00000118513; ENSG00000073712; ENSG00000184194; ENSG00000103089; ENSG00000267534; ENSG00000080224; ENSG00000100625; ENSG00000128886; ENSG00000132970; ENSG00000112902; ENSG00000142513; ENSG00000136280; ENSG00000184113; ENSG00000149781; ENSG00000147065; ENSG00000124766; ENSG00000176749; ENSG00000139767; ENSG00000101977; ENSG00000170175; ENSG00000196338; ENSG00000196562; ENSG00000183688; ENSG00000188613; ENSG00000110880; ENSG00000092964; ENSG00000114251; ENSG00000100271; ENSG00000177508; ENSG00000172238; ENSG00000166579; ENSG00000095539; ENSG00000163251; ENSG00000165704; ENSG00000137573; ENSG00000170961; ENSG00000004848; ENSG00000113749; ENSG00000050555; ENSG00000185053; ENSG00000178235; ENSG00000118689; ENSG00000116044; ENSG00000130347; ENSG00000110400; ENSG00000114745; ENSG00000184564; ENSG00000172260; ENSG00000114383; ENSG00000148948; ENSG00000175324; ENSG00000133703; ENSG00000147596; ENSG00000171587; ENSG00000121039; ENSG00000197555; ENSG00000125533; ENSG00000221866; ENSG00000164690; ENSG00000220201; ENSG00000005513; ENSG00000151615; ENSG00000189403; ENSG00000050030	2110	556
0.000949443518232	0.227395509138	GO:0030182	b	4	neuron differentiation	102; 182; 183; 347; 351; 393; 430; 474; 538; 604; 639; 653; 1002; 1072; 5653; 1268; 1385; 1605; 1620; 1716; 1745; 1746; 1808; 1826; 1910; 1943; 1949; 1969; 2016; 2050; 2260; 2309; 170302; 2624; 2636; 2647; 2670; 2674; 2676; 2775; 2823; 2887; 2909; 3082; 3146; 3196; 3251; 3397; 3549; 3642; 3730; 3792; 3798; 3956; 3984; 4038; 4131; 4168; 4208; 4343; 4780; 4825; 4851; 4854; 4884; 4915; 4929; 5063; 5087; 5090; 5274; 5361; 5362; 5376; 5454; 5458; 5469; 5501; 5756; 5818; 5923; 6096; 6277; 6469; 6495; 6496; 6507; 6656; 6658; 6659; 6722; 6853; 55773; 7248; 7336; 7368; 7399; 7474; 7476; 7477; 7481; 7484; 7504; 7855; 7976; 401236; 8322; 8324; 8408; 8482; 8506; 8543; 8578; 8660; 23303; 9037; 9211; 9231; 9369; 64689; 9745; 10059; 81029; 10265; 10371; 10417; 10479; 10565; 10631; 10660; 10716; 10769; 10818; 10882; 11166; 11211; 7482; 60436; 340719; 285220; 79191; 80128; 266727; 113246; 323; 81532; 81551; 81565; 114788; 114798; 57451; 57465; 8325; 51399; 118427; 112724; 116443; 116448; 51062; 84059; 84189; 84530; 117531; 84816; 9373; 84894; 85407; 440275; 8851; 53358; 431707; 54413; 54541; 54549; 9529; 54910; 55118; 219409; 22865; 22943; 23105; 23242; 23271; 23287; 23380; 23440; 23654; 23767; 23769; 11141; 100132074; 56896; 56920; 57118; 11075; 90167; 57453; 57624; 57662; 57689; 91584; 58158; 58190; 26037; 26050; 26281; 223117; 59335; 124936; 157922; 57643; 27257; 27289; 257194; 93650; 28988; 57715; 150465; 22809; 3170; 161357; 30812; 30819; 63915; 391723; 54434; 65125; 22903	ENSG00000196411; ENSG00000189058; ENSG00000160007; ENSG00000230873; ENSG00000087258; ENSG00000123307; ENSG00000114956; ENSG00000197956; ENSG00000136279; ENSG00000169306; ENSG00000169840; ENSG00000165300; ENSG00000128829; ENSG00000182208; ENSG00000162065; ENSG00000066777; ENSG00000134245; ENSG00000184221; ENSG00000167740; ENSG00000019991; ENSG00000060237; ENSG00000084112; ENSG00000196655; ENSG00000089820; ENSG00000168209; ENSG00000138623; ENSG00000106070; ENSG00000164796; ENSG00000151239; ENSG00000169783; ENSG00000106078; ENSG00000157851; ENSG00000182968; ENSG00000163623; ENSG00000144579; ENSG00000159674; ENSG00000160439; ENSG00000111186; ENSG00000153993; ENSG00000118200; ENSG00000130559; ENSG00000132640; ENSG00000135441; ENSG00000171246; ENSG00000079215; ENSG00000111678; ENSG00000198963; ENSG00000165240; ENSG00000125285; ENSG00000145934; ENSG00000167755; ENSG00000177169; ENSG00000186298; ENSG00000134569; ENSG00000008056; ENSG00000036054; ENSG00000151208; ENSG00000118707; ENSG00000112139; ENSG00000114554; ENSG00000011201; ENSG00000101384; ENSG00000188428; ENSG00000166225; ENSG00000115297; ENSG00000154764; ENSG00000069188; ENSG00000150625; ENSG00000171540; ENSG00000126500; ENSG00000085741; ENSG00000165694; ENSG00000153234; ENSG00000148400; ENSG00000174804; ENSG00000184486; ENSG00000138083; ENSG00000108231; ENSG00000118260; ENSG00000077782; ENSG00000130711; ENSG00000138136; ENSG00000125798; ENSG00000074660; ENSG00000135049; ENSG00000100097; ENSG00000112658; ENSG00000185950; ENSG00000131094; ENSG00000131095; ENSG00000121871; ENSG00000108947; ENSG00000134595; ENSG00000151892; ENSG00000112175; ENSG00000163462; ENSG00000115844; ENSG00000140807; ENSG00000164199; ENSG00000179348; ENSG00000183049; ENSG00000163501; ENSG00000142627; ENSG00000120049; ENSG00000010319; ENSG00000104290; ENSG00000125848; ENSG00000135744; ENSG00000125968; ENSG00000196576; ENSG00000118733; ENSG00000116044; ENSG00000077264; ENSG00000081189; ENSG00000164690; ENSG00000151615; ENSG00000131711; ENSG00000074181; ENSG00000173404; ENSG00000075213; ENSG00000173402; ENSG00000133110; ENSG00000172260; ENSG00000078725; ENSG00000158955; ENSG00000162415; ENSG00000165699; ENSG00000136535; ENSG00000148948; ENSG00000118432; ENSG00000163697; ENSG00000198597; ENSG00000108797; ENSG00000183734; ENSG00000155760; ENSG00000135638; ENSG00000099617; ENSG00000155363; ENSG00000146013; ENSG00000197993; ENSG00000076826; ENSG00000198513; ENSG00000198785; ENSG00000172602; ENSG00000164900; ENSG00000169139; ENSG00000137055; ENSG00000188064; ENSG00000076356; ENSG00000177283; ENSG00000266028; ENSG00000144355; ENSG00000095713; ENSG00000109099; ENSG00000087470; ENSG00000053108; ENSG00000179242; ENSG00000169136; ENSG00000177103; ENSG00000078579; ENSG00000058335; ENSG00000187821; ENSG00000106683; ENSG00000145632; ENSG00000113916; ENSG00000174607; ENSG00000162624; ENSG00000057657; ENSG00000155980; ENSG00000126778; ENSG00000125686; ENSG00000015592; ENSG00000111432; ENSG00000107984; ENSG00000176842; ENSG00000136160; ENSG00000185630; ENSG00000047597; ENSG00000148053; ENSG00000142192; ENSG00000021645; ENSG00000144460; ENSG00000163536; ENSG00000204060; ENSG00000148082; ENSG00000197892; ENSG00000167081; ENSG00000114999; ENSG00000166170; ENSG00000165091; ENSG00000176749; ENSG00000080224; ENSG00000221866; ENSG00000112902; ENSG00000142513; ENSG00000198689; ENSG00000124766; ENSG00000139767; ENSG00000101977; ENSG00000175324; ENSG00000196338; ENSG00000104435; ENSG00000139915; ENSG00000188613; ENSG00000092964; ENSG00000114251; ENSG00000177508; ENSG00000172238; ENSG00000166579; ENSG00000095539; ENSG00000163251; ENSG00000165704; ENSG00000004848; ENSG00000168758; ENSG00000178235; ENSG00000118689; ENSG00000137845; ENSG00000130347; ENSG00000110400; ENSG00000114745; ENSG00000184564; ENSG00000143013; ENSG00000042781; ENSG00000171587; ENSG00000197555; ENSG00000005513; ENSG00000172757; ENSG00000189403	1338	362
0.00115077934558	0.227395509138	GO:0060485	b	4	mesenchyme development	90; 182; 653; 677; 1072; 1605; 1910; 2255; 2260; 2294; 2626; 3082; 199699; 4017; 4088; 4092; 4208; 4488; 4609; 4838; 4851; 5075; 5311; 202018; 6469; 6495; 6591; 6615; 6910; 6939; 7043; 7291; 7474; 7481; 8313; 8482; 8642; 9037; 205717; 9231; 10371; 23603; 78987; 80139; 80237; 81610; 114990; 147906; 3037; 51176; 100289087; 51804; 221662; 348262; 54796; 54910; 23462; 286204; 56920; 157506; 223117; 26585; 57715; 3170; 30812; 359845	ENSG00000019549; ENSG00000121039; ENSG00000136160; ENSG00000075213; ENSG00000173402; ENSG00000153993; ENSG00000115170; ENSG00000136574; ENSG00000138795; ENSG00000168140; ENSG00000197380; ENSG00000185650; ENSG00000125813; ENSG00000148400; ENSG00000101384; ENSG00000183779; ENSG00000070193; ENSG00000101447; ENSG00000148204; ENSG00000019991; ENSG00000100625; ENSG00000077782; ENSG00000156574; ENSG00000112902; ENSG00000118762; ENSG00000138623; ENSG00000089225; ENSG00000183688; ENSG00000169762; ENSG00000124216; ENSG00000173068; ENSG00000164683; ENSG00000085741; ENSG00000225663; ENSG00000114251; ENSG00000125798; ENSG00000126778; ENSG00000166341; ENSG00000125878; ENSG00000163703; ENSG00000176542; ENSG00000168758; ENSG00000005513; ENSG00000151208; ENSG00000119699; ENSG00000168646; ENSG00000112183; ENSG00000122691; ENSG00000172757; ENSG00000166923; ENSG00000010319; ENSG00000120149; ENSG00000236424; ENSG00000166949; ENSG00000095539; ENSG00000134013; ENSG00000101665; ENSG00000136997; ENSG00000128886; ENSG00000110880; ENSG00000112175; ENSG00000170961; ENSG00000179284; ENSG00000081189; ENSG00000164690; ENSG00000103241	266	93
0.0012525417518	0.289337144666	GO:0045211	c	3	postsynaptic membrane	102; 613; 747; 1129; 1140; 1605; 1949; 2556; 2557; 2743; 2899; 2903; 2911; 2915; 3361; 3736; 3738; 3745; 3756; 3761; 7779; 4593; 4986; 5100; 5913; 6529; 6536; 8572; 8787; 23345; 9093; 729993; 9231; 80059; 80315; 81832; 81926; 114798; 57451; 2912; 116443; 84896; 347730; 642938; 54413; 54910; 22865; 23380; 23767; 11141; 57528; 254263; 57689; 9746; 26037; 26045; 27091; 27092; 27253; 93650; 94030; 94056; 64101; 22986	ENSG00000178235; ENSG00000196517; ENSG00000158445; ENSG00000125848; ENSG00000166342; ENSG00000146006; ENSG00000177272; ENSG00000148948; ENSG00000157103; ENSG00000138138; ENSG00000173402; ENSG00000168959; ENSG00000136099; ENSG00000108370; ENSG00000181072; ENSG00000131018; ENSG00000183454; ENSG00000128594; ENSG00000156395; ENSG00000169306; ENSG00000030304; ENSG00000118946; ENSG00000075429; ENSG00000162951; ENSG00000170385; ENSG00000186716; ENSG00000142513; ENSG00000174871; ENSG00000170175; ENSG00000196338; ENSG00000139182; ENSG00000165917; ENSG00000082556; ENSG00000121871; ENSG00000075461; ENSG00000198785; ENSG00000108947; ENSG00000266028; ENSG00000237515; ENSG00000188916; ENSG00000168758; ENSG00000183775; ENSG00000113742; ENSG00000131409; ENSG00000109158; ENSG00000129968; ENSG00000143473; ENSG00000176204; ENSG00000169895; ENSG00000145934; ENSG00000109738; ENSG00000011677; ENSG00000152822; ENSG00000168135; ENSG00000103423; ENSG00000111262; ENSG00000131435; ENSG00000151208; ENSG00000197555; ENSG00000157219; ENSG00000137845; ENSG00000163873; ENSG00000134780; ENSG00000164082	323	90
0.00128204955474	0.0821880999158	GO:0007155	b	2	cell adhesion	90; 102; 182; 285; 347; 351; 388; 604; 653; 677; 708; 64405; 857; 977; 1002; 1004; 1016; 1295; 1307; 1364; 1445; 1465; 1605; 1826; 1828; 1949; 1969; 2050; 2294; 2812; 3146; 3315; 3397; 3483; 3491; 3549; 3593; 3655; 3671; 3694; 3730; 3956; 4017; 4088; 4091; 4092; 4162; 4478; 4602; 4838; 4851; 4868; 5063; 5067; 5074; 5100; 5140; 5175; 5274; 5317; 5341; 5361; 5362; 5607; 22801; 5777; 5818; 5961; 6247; 6282; 6469; 6591; 6722; 6793; 170692; 7057; 7122; 7248; 7450; 7474; 7477; 7535; 80139; 1540; 1285; 8038; 8322; 8324; 729230; 8506; 8578; 8631; 8642; 8727; 9037; 9051; 9069; 9093; 9231; 9270; 9358; 9369; 9475; 9530; 55966; 9595; 55971; 9806; 10049; 10319; 10395; 10398; 10417; 10418; 10516; 23603; 10631; 10725; 10979; 340533; 51441; 79576; 79626; 472; 80005; 80149; 145864; 81704; 266727; 114798; 90187; 57451; 49861; 50509; 50624; 83660; 83706; 3037; 51176; 84059; 117583; 8851; 137075; 54413; 54510; 54549; 5819; 54997; 3707; 22865; 23380; 56339; 23654; 220296; 23767; 23769; 11141; 286204; 9473; 253559; 57007; 57453; 57575; 57662; 57689; 91584; 9746; 58494; 25890; 26032; 91663; 255743; 26585; 92552; 27253; 27286; 27289; 27302; 27328; 388125; 257194; 94030; 10296; 3170; 65125; 136227; 63827; 64101; 64129	ENSG00000196411; ENSG00000189058; ENSG00000138650; ENSG00000159176; ENSG00000144476; ENSG00000161270; ENSG00000138795; ENSG00000115956; ENSG00000126500; ENSG00000198492; ENSG00000091409; ENSG00000101335; ENSG00000102908; ENSG00000060237; ENSG00000157224; ENSG00000169031; ENSG00000102290; ENSG00000189184; ENSG00000113805; ENSG00000115221; ENSG00000159674; ENSG00000130202; ENSG00000149781; ENSG00000142871; ENSG00000111679; ENSG00000147459; ENSG00000105974; ENSG00000083799; ENSG00000163191; ENSG00000151208; ENSG00000183798; ENSG00000081277; ENSG00000137764; ENSG00000134760; ENSG00000169306; ENSG00000114554; ENSG00000011201; ENSG00000101384; ENSG00000178235; ENSG00000113302; ENSG00000140873; ENSG00000138161; ENSG00000185650; ENSG00000141293; ENSG00000113916; ENSG00000175161; ENSG00000163217; ENSG00000148400; ENSG00000118946; ENSG00000136099; ENSG00000137834; ENSG00000080573; ENSG00000262655; ENSG00000074660; ENSG00000102104; ENSG00000143772; ENSG00000144810; ENSG00000149654; ENSG00000100097; ENSG00000107099; ENSG00000112658; ENSG00000177425; ENSG00000179820; ENSG00000121871; ENSG00000261371; ENSG00000108947; ENSG00000050555; ENSG00000112139; ENSG00000189143; ENSG00000253958; ENSG00000205502; ENSG00000125968; ENSG00000164199; ENSG00000160963; ENSG00000164741; ENSG00000163501; ENSG00000142627; ENSG00000166923; ENSG00000163874; ENSG00000132692; ENSG00000168743; ENSG00000125848; ENSG00000076706; ENSG00000103423; ENSG00000147065; ENSG00000140368; ENSG00000196576; ENSG00000170961; ENSG00000137845; ENSG00000077264; ENSG00000143878; ENSG00000164690; ENSG00000019549; ENSG00000173402; ENSG00000090316; ENSG00000133110; ENSG00000101882; ENSG00000172260; ENSG00000107742; ENSG00000115170; ENSG00000152270; ENSG00000165699; ENSG00000108797; ENSG00000155760; ENSG00000156574; ENSG00000139182; ENSG00000129009; ENSG00000076826; ENSG00000119326; ENSG00000149311; ENSG00000196581; ENSG00000091879; ENSG00000140092; ENSG00000172602; ENSG00000140511; ENSG00000188064; ENSG00000076356; ENSG00000115165; ENSG00000266028; ENSG00000105993; ENSG00000103653; ENSG00000110400; ENSG00000165478; ENSG00000123594; ENSG00000113361; ENSG00000179242; ENSG00000166341; ENSG00000099769; ENSG00000110799; ENSG00000148848; ENSG00000101665; ENSG00000154175; ENSG00000110880; ENSG00000112175; ENSG00000171914; ENSG00000166949; ENSG00000203618; ENSG00000119185; ENSG00000165819; ENSG00000142192; ENSG00000021645; ENSG00000148204; ENSG00000163536; ENSG00000121807; ENSG00000108561; ENSG00000072786; ENSG00000198542; ENSG00000118513; ENSG00000073712; ENSG00000130775; ENSG00000112619; ENSG00000171217; ENSG00000221866; ENSG00000112902; ENSG00000115085; ENSG00000184113; ENSG00000163154; ENSG00000106211; ENSG00000176749; ENSG00000173705; ENSG00000177697; ENSG00000196338; ENSG00000116117; ENSG00000084636; ENSG00000102359; ENSG00000131409; ENSG00000114251; ENSG00000125798; ENSG00000174804; ENSG00000069188; ENSG00000134318; ENSG00000142910; ENSG00000183779; ENSG00000006453; ENSG00000088992; ENSG00000145934; ENSG00000177103; ENSG00000145526; ENSG00000148948; ENSG00000154721; ENSG00000134013; ENSG00000171587; ENSG00000137801; ENSG00000128594; ENSG00000156735; ENSG00000137809; ENSG00000189403; ENSG00000050030; ENSG00000103241	1389	297
