p-value	q-value	term_goid	term_category	term_level	term_name	members_input_overlap	members_input_overlap_geneids	size	effective_size
0.000564823102039	0.121315918755	GO:0009615	b	3	response to virus	708; 1072; 4986; 5495; 10417; 83666; 51728; 22948; 27297; 91543	RSAD2; SPON2; CRCP; PARP9; C1QBP; CCT5; CFL1; OPRK1; POLR3K; PPM1B	326	40
0.000933671612707	0.103637549011	GO:0031294	b	2	lymphocyte costimulation	857; 1445; 1949; 5777	EFNB3; PTPN6; CSK; CAV1	56	7
0.000933671612707	0.121315918755	GO:0031295	b	3	T cell costimulation	857; 1445; 1949; 5777	EFNB3; PTPN6; CSK; CAV1	55	7
0.00136895027312	0.121315918755	GO:0043900	b	3	regulation of multi-organism process	708; 857; 1072; 5495; 23435; 60343; 23236; 83666; 51652; 23367; 91543	PLCB1; PARP9; PPM1B; LARP1; FAM3A; C1QBP; CFL1; CHMP3; CAV1; RSAD2; TARDBP	378	52
0.00159768493569	0.63192653608	GO:0060627	b	4	regulation of vesicle-mediated transport	857; 977; 1175; 1445; 5562; 399687; 6843; 10434; 51652; 22943; 254263; 26045; 60682	VAMP1; SMAP1; AP2S1; CNIH2; CSK; CD151; LYPLA1; PRKAA1; DKK1; MYO18A; LRRTM2; CHMP3; CAV1	529	69
0.00162840159403	0.121315918755	GO:0051607	b	3	defense response to virus	708; 4986; 5495; 10417; 83666; 51728; 27297; 91543	SPON2; CRCP; PPM1B; C1QBP; RSAD2; OPRK1; POLR3K; PARP9	241	31
0.00270177395348	0.161025727628	GO:0030901	b	3	midbrain development	4086; 5810; 7976; 8323; 22943	FZD6; FZD3; SMAD1; RAD1; DKK1	94	14
0.00387562044742	0.321676497135	GO:0099055	c	4	integral component of postsynaptic membrane	1949; 2557; 4986; 5100; 6536; 254263; 26045	PCDH8; EFNB3; CNIH2; SLC6A9; LRRTM2; OPRK1; GABRA4	117	28
0.00406801698175	0.41603365216	GO:0140053	b	5	mitochondrial gene expression	708; 5442; 5562; 9617; 51081; 78988; 79590; 87178; 55168; 29088	MTRF1; MRPL15; MRPL24; MRPS7; PNPT1; MRPS18A; PRKAA1; MRPL57; C1QBP; POLRMT	160	51
0.00466838894513	0.382807893501	GO:0097747	m	3	RNA polymerase activity	5438; 5442; 51728; 27297	POLRMT; CRCP; POLR2I; POLR3K	45	10
0.00466838894513	0.318131399579	GO:0034062	m	4	5,-3, RNA polymerase activity	5438; 5442; 51728; 27297	POLRMT; CRCP; POLR2I; POLR3K	45	10
0.00466838894513	0.238087836202	GO:0003899	m	5	DNA-directed 5,-3, RNA polymerase activity	5438; 5442; 51728; 27297	POLRMT; CRCP; POLR2I; POLR3K	42	10
0.00478697389889	0.197310590727	GO:0098936	c	3	intrinsic component of postsynaptic membrane	1949; 2557; 4986; 5100; 6536; 254263; 26045	PCDH8; EFNB3; CNIH2; SLC6A9; LRRTM2; OPRK1; GABRA4	122	29
0.00553197076382	0.63192653608	GO:0098542	b	4	defense response to other organism	708; 4986; 5495; 60343; 10417; 83666; 51728; 27297; 91543	SPON2; CRCP; PARP9; FAM3A; C1QBP; RSAD2; OPRK1; POLR3K; PPM1B	590	45
0.00571173049907	0.283682614787	GO:1904693	b	3	midbrain morphogenesis	7976; 8323	FZD3; FZD6	3	2
0.00571173049907	0.197310590727	GO:0031588	c	3	nucleotide-activated protein kinase complex	5562; 5576	PRKAR2A; PRKAA1	14	2
0.00590380828042	0.63192653608	GO:0051049	b	4	regulation of transport	185; 857; 977; 1175; 1445; 2029; 4825; 4986; 5026; 5311; 5562; 5777; 399687; 6843; 8645; 23435; 9727; 10105; 10434; 79570; 148811; 51652; 117531; 118424; 54997; 22943; 9388; 254263; 26045; 60682; 91543; 29850	TMC1; UBE2J2; LYPLA1; PRKAA1; MYO18A; CHMP3; DKK1; P2RX5; RSAD2; CAV1; SMAP1; AP2S1; CNIH2; LIPG; KCNK5; ENSA; LRRTM2; TRPM5; NKX6-1; NKAIN1; RAB11FIP3; CSK; OPRK1; PM20D1; PTPN6; TARDBP; VAMP1; CD151; PKD2; TESC; PPIF; AGTR1	1799	271
0.0059434990859	0.63192653608	GO:0043901	b	4	negative regulation of multi-organism process	708; 5495; 23435; 60343; 51652; 91543	PPM1B; FAM3A; C1QBP; CHMP3; RSAD2; TARDBP	175	23
0.0069209576655	0.63192653608	GO:0060402	b	4	calcium ion transport into cytosol	857; 5026; 5311; 5777; 8989	TRPA1; PKD2; P2RX5; PTPN6; CAV1	145	17
0.00743442983624	0.63192653608	GO:0043903	b	4	regulation of symbiosis, encompassing mutualism through parasitism	857; 1072; 23435; 51652; 23367; 91543	LARP1; CFL1; CHMP3; CAV1; RSAD2; TARDBP	206	24
0.00743442983624	0.41603365216	GO:0051592	b	5	response to calcium ion	857; 4331; 5311; 5562; 10105; 85365	ALG2; PKD2; PRKAA1; PPIF; MNAT1; CAV1	152	24
0.00877671020853	0.41603365216	GO:0045088	b	5	regulation of innate immune response	708; 857; 5777; 60343; 1540; 83666; 91543; 27293	SMPDL3B; PARP9; FAM3A; C1QBP; RSAD2; CYLD; PTPN6; CAV1	381	40
0.00905861008912	0.331111304169	GO:0051707	b	2	response to other organism	708; 857; 1072; 4986; 5495; 60343; 10417; 10935; 83666; 51728; 22948; 27297; 91543; 129607	RSAD2; SPON2; PARP9; PPM1B; FAM3A; CMPK2; PRDX3; CRCP; C1QBP; CCT5; CFL1; OPRK1; POLR3K; CAV1	1020	93
0.00905861008912	0.369735714777	GO:0043207	b	3	response to external biotic stimulus	708; 857; 1072; 4986; 5495; 60343; 10417; 10935; 83666; 51728; 22948; 27297; 91543; 129607	RSAD2; SPON2; PARP9; PPM1B; FAM3A; CMPK2; PRDX3; CRCP; C1QBP; CCT5; CFL1; OPRK1; POLR3K; CAV1	1022	93
0.00975247114747	0.657059324638	GO:0010522	b	4	regulation of calcium ion transport into cytosol	857; 5026; 5311; 5777	PKD2; P2RX5; PTPN6; CAV1	96	12
0.00992579100073	0.369735714777	GO:0032879	b	3	regulation of localization	185; 393; 653; 708; 857; 977; 1175; 1445; 2029; 3491; 4825; 4986; 5026; 5311; 5562; 5777; 399687; 6843; 1540; 8645; 8989; 23435; 9727; 10105; 10434; 23236; 79570; 148811; 83666; 51652; 117531; 118424; 54997; 55036; 55171; 22943; 22948; 9388; 23678; 254263; 56034; 26045; 57643; 60682; 91543; 29850	TMC1; UBE2J2; PLCB1; LYPLA1; PRKAA1; CCDC40; MYO18A; PDGFC; ARHGAP4; TRPA1; DKK1; P2RX5; RSAD2; CAV1; SMAP1; AP2S1; CNIH2; LIPG; KCNK5; C1QBP; CCT5; ZSWIM5; ENSA; LRRTM2; TRPM5; NKX6-1; NKAIN1; RAB11FIP3; TBCCD1; CYR61; PARP9; CSK; OPRK1; PM20D1; PTPN6; TARDBP; VAMP1; BMP5; SGK3; CD151; PKD2; TESC; CYLD; PPIF; AGTR1; CHMP3	2663	439